"Length","Info"
"66","52405  >  80 [SYN] Seq=0 Win=8192 Len=0 MSS=1460 WS=256 SACK_PERM=1"
"60","80  >  52405 [SYN, ACK] Seq=0 Ack=1 Win=64240 Len=0 MSS=1460"
"54","52405  >  80 [ACK] Seq=1 Ack=1 Win=64240 Len=0"
"485","GET /nv2/Nv2-PC.zip HTTP/1.1 "
"60","80  >  52405 [ACK] Seq=1 Ack=432 Win=64240 Len=0"
"1502","80  >  52405 [PSH, ACK] Seq=1 Ack=432 Win=64240 Len=1448 [TCP segment of a reassembled PDU]"
"1502","80  >  52405 [PSH, ACK] Seq=1449 Ack=432 Win=64240 Len=1448 [TCP segment of a reassembled PDU]"
"54","52405  >  80 [ACK] Seq=432 Ack=2897 Win=64240 Len=0"
"1514","80  >  52405 [ACK] Seq=2897 Ack=432 Win=64240 Len=1460 [TCP segment of a reassembled PDU]"
"1514","80  >  52405 [ACK] Seq=4357 Ack=432 Win=64240 Len=1460 [TCP segment of a reassembled PDU]"
"1514","80  >  52405 [ACK] Seq=5817 Ack=432 Win=64240 Len=1460 [TCP segment of a reassembled PDU]"
"54","52405  >  80 [ACK] Seq=432 Ack=7277 Win=64240 Len=0"
"1514","80  >  52405 [ACK] Seq=7277 Ack=432 Win=64240 Len=1460 [TCP segment of a reassembled PDU]"
"1514","80  >  52405 [ACK] Seq=8737 Ack=432 Win=64240 Len=1460 [TCP segment of a reassembled PDU]"
"1514","80  >  52405 [ACK] Seq=10197 Ack=432 Win=64240 Len=1460 [TCP segment of a reassembled PDU]"
"1514","80  >  52405 [ACK] Seq=11657 Ack=432 Win=64240 Len=1460 [TCP segment of a reassembled PDU]"
"1514","80  >  52405 [ACK] Seq=13117 Ack=432 Win=64240 Len=1460 [TCP segment of a reassembled PDU]"
"1514","80  >  52405 [ACK] Seq=14577 Ack=432 Win=64240 Len=1460 [TCP segment of a reassembled PDU]"
"1514","80  >  52405 [ACK] Seq=16037 Ack=432 Win=64240 Len=1460 [TCP segment of a reassembled PDU]"
"1514","80  >  52405 [ACK] Seq=17497 Ack=432 Win=64240 Len=1460 [TCP segment of a reassembled PDU]"
"850","80  >  52405 [PSH, ACK] Seq=18957 Ack=432 Win=64240 Len=796 [TCP segment of a reassembled PDU]"
"54","52405  >  80 [ACK] Seq=432 Ack=19753 Win=56144 Len=0"
"54","[TCP Window Update] 52405  >  80 [ACK] Seq=432 Ack=19753 Win=64240 Len=0"
"1514","80  >  52405 [ACK] Seq=19753 Ack=432 Win=64240 Len=1460 [TCP segment of a reassembled PDU]"
"1514","80  >  52405 [ACK] Seq=21213 Ack=432 Win=64240 Len=1460 [TCP segment of a reassembled PDU]"
"1514","80  >  52405 [ACK] Seq=22673 Ack=432 Win=64240 Len=1460 [TCP segment of a reassembled PDU]"
"1466","80  >  52405 [PSH, ACK] Seq=24133 Ack=432 Win=64240 Len=1412 [TCP segment of a reassembled PDU]"
"54","52405  >  80 [ACK] Seq=432 Ack=25545 Win=64240 Len=0"
"1514","80  >  52405 [ACK] Seq=25545 Ack=432 Win=64240 Len=1460 [TCP segment of a reassembled PDU]"
"1514","80  >  52405 [ACK] Seq=27005 Ack=432 Win=64240 Len=1460 [TCP segment of a reassembled PDU]"
"1514","80  >  52405 [ACK] Seq=28465 Ack=432 Win=64240 Len=1460 [TCP segment of a reassembled PDU]"
"1514","80  >  52405 [ACK] Seq=29925 Ack=432 Win=64240 Len=1460 [TCP segment of a reassembled PDU]"
"1514","80  >  52405 [ACK] Seq=31385 Ack=432 Win=64240 Len=1460 [TCP segment of a reassembled PDU]"
"1514","80  >  52405 [ACK] Seq=32845 Ack=432 Win=64240 Len=1460 [TCP segment of a reassembled PDU]"
"1514","80  >  52405 [ACK] Seq=34305 Ack=432 Win=64240 Len=1460 [TCP segment of a reassembled PDU]"
"1514","80  >  52405 [ACK] Seq=35765 Ack=432 Win=64240 Len=1460 [TCP segment of a reassembled PDU]"
"1514","80  >  52405 [ACK] Seq=37225 Ack=432 Win=64240 Len=1460 [TCP segment of a reassembled PDU]"
"1514","80  >  52405 [ACK] Seq=38685 Ack=432 Win=64240 Len=1460 [TCP segment of a reassembled PDU]"
"1514","80  >  52405 [ACK] Seq=40145 Ack=432 Win=64240 Len=1460 [TCP segment of a reassembled PDU]"
"1514","80  >  52405 [ACK] Seq=41605 Ack=432 Win=64240 Len=1460 [TCP segment of a reassembled PDU]"
"1358","80  >  52405 [PSH, ACK] Seq=43065 Ack=432 Win=64240 Len=1304 [TCP segment of a reassembled PDU]"
"54","52405  >  80 [ACK] Seq=432 Ack=44369 Win=54176 Len=0"
"54","[TCP Window Update] 52405  >  80 [ACK] Seq=432 Ack=44369 Win=64240 Len=0"
"1502","80  >  52405 [PSH, ACK] Seq=44369 Ack=432 Win=64240 Len=1448 [TCP segment of a reassembled PDU]"
"1502","80  >  52405 [PSH, ACK] Seq=45817 Ack=432 Win=64240 Len=1448 [TCP segment of a reassembled PDU]"
"54","52405  >  80 [ACK] Seq=432 Ack=47265 Win=64240 Len=0"
"1514","80  >  52405 [ACK] Seq=47265 Ack=432 Win=64240 Len=1460 [TCP segment of a reassembled PDU]"
"1490","80  >  52405 [PSH, ACK] Seq=48725 Ack=432 Win=64240 Len=1436 [TCP segment of a reassembled PDU]"
"54","52405  >  80 [ACK] Seq=432 Ack=50161 Win=64240 Len=0"
"1514","80  >  52405 [ACK] Seq=50161 Ack=432 Win=64240 Len=1460 [TCP segment of a reassembled PDU]"
"1514","80  >  52405 [ACK] Seq=51621 Ack=432 Win=64240 Len=1460 [TCP segment of a reassembled PDU]"
"1514","80  >  52405 [ACK] Seq=53081 Ack=432 Win=64240 Len=1460 [TCP segment of a reassembled PDU]"
"1514","80  >  52405 [ACK] Seq=54541 Ack=432 Win=64240 Len=1460 [TCP segment of a reassembled PDU]"
"1454","80  >  52405 [PSH, ACK] Seq=56001 Ack=432 Win=64240 Len=1400 [TCP segment of a reassembled PDU]"
"1502","80  >  52405 [PSH, ACK] Seq=57401 Ack=432 Win=64240 Len=1448 [TCP segment of a reassembled PDU]"
"54","52405  >  80 [ACK] Seq=432 Ack=58849 Win=64240 Len=0"
"1502","80  >  52405 [PSH, ACK] Seq=58849 Ack=432 Win=64240 Len=1448 [TCP segment of a reassembled PDU]"
"1502","80  >  52405 [PSH, ACK] Seq=60297 Ack=432 Win=64240 Len=1448 [TCP segment of a reassembled PDU]"
"54","52405  >  80 [ACK] Seq=432 Ack=61745 Win=64240 Len=0"
"1514","80  >  52405 [ACK] Seq=61745 Ack=432 Win=64240 Len=1460 [TCP segment of a reassembled PDU]"
"1490","80  >  52405 [PSH, ACK] Seq=63205 Ack=432 Win=64240 Len=1436 [TCP segment of a reassembled PDU]"
"54","52405  >  80 [ACK] Seq=432 Ack=64641 Win=64240 Len=0"
"1514","80  >  52405 [ACK] Seq=64641 Ack=432 Win=64240 Len=1460 [TCP segment of a reassembled PDU]"
"1514","80  >  52405 [ACK] Seq=66101 Ack=432 Win=64240 Len=1460 [TCP segment of a reassembled PDU]"
"1514","80  >  52405 [ACK] Seq=67561 Ack=432 Win=64240 Len=1460 [TCP segment of a reassembled PDU]"
"1514","80  >  52405 [ACK] Seq=69021 Ack=432 Win=64240 Len=1460 [TCP segment of a reassembled PDU]"
"1454","80  >  52405 [PSH, ACK] Seq=70481 Ack=432 Win=64240 Len=1400 [TCP segment of a reassembled PDU]"
"54","52405  >  80 [ACK] Seq=432 Ack=71881 Win=64240 Len=0"
"1514","80  >  52405 [ACK] Seq=71881 Ack=432 Win=64240 Len=1460 [TCP segment of a reassembled PDU]"
"1514","80  >  52405 [ACK] Seq=73341 Ack=432 Win=64240 Len=1460 [TCP segment of a reassembled PDU]"
"1514","80  >  52405 [ACK] Seq=74801 Ack=432 Win=64240 Len=1460 [TCP segment of a reassembled PDU]"
"1466","80  >  52405 [PSH, ACK] Seq=76261 Ack=432 Win=64240 Len=1412 [TCP segment of a reassembled PDU]"
"54","52405  >  80 [ACK] Seq=432 Ack=77673 Win=64240 Len=0"
"1502","80  >  52405 [PSH, ACK] Seq=77673 Ack=432 Win=64240 Len=1448 [TCP segment of a reassembled PDU]"
"1502","80  >  52405 [PSH, ACK] Seq=79121 Ack=432 Win=64240 Len=1448 [TCP segment of a reassembled PDU]"
"54","52405  >  80 [ACK] Seq=432 Ack=80569 Win=64240 Len=0"
"1502","80  >  52405 [PSH, ACK] Seq=80569 Ack=432 Win=64240 Len=1448 [TCP segment of a reassembled PDU]"
"1514","80  >  52405 [ACK] Seq=82017 Ack=432 Win=64240 Len=1460 [TCP segment of a reassembled PDU]"
"1490","80  >  52405 [PSH, ACK] Seq=83477 Ack=432 Win=64240 Len=1436 [TCP segment of a reassembled PDU]"
"54","52405  >  80 [ACK] Seq=432 Ack=84913 Win=64240 Len=0"
"1502","80  >  52405 [PSH, ACK] Seq=84913 Ack=432 Win=64240 Len=1448 [TCP segment of a reassembled PDU]"
"1502","80  >  52405 [PSH, ACK] Seq=86361 Ack=432 Win=64240 Len=1448 [TCP segment of a reassembled PDU]"
"54","52405  >  80 [ACK] Seq=432 Ack=87809 Win=64240 Len=0"
"1502","80  >  52405 [PSH, ACK] Seq=87809 Ack=432 Win=64240 Len=1448 [TCP segment of a reassembled PDU]"
"1502","80  >  52405 [PSH, ACK] Seq=89257 Ack=432 Win=64240 Len=1448 [TCP segment of a reassembled PDU]"
"54","52405  >  80 [ACK] Seq=432 Ack=90705 Win=64240 Len=0"
"1502","80  >  52405 [PSH, ACK] Seq=90705 Ack=432 Win=64240 Len=1448 [TCP segment of a reassembled PDU]"
"1502","80  >  52405 [PSH, ACK] Seq=92153 Ack=432 Win=64240 Len=1448 [TCP segment of a reassembled PDU]"
"54","52405  >  80 [ACK] Seq=432 Ack=93601 Win=64240 Len=0"
"1502","80  >  52405 [PSH, ACK] Seq=93601 Ack=432 Win=64240 Len=1448 [TCP segment of a reassembled PDU]"
"1502","80  >  52405 [PSH, ACK] Seq=95049 Ack=432 Win=64240 Len=1448 [TCP segment of a reassembled PDU]"
"54","52405  >  80 [ACK] Seq=432 Ack=96497 Win=64240 Len=0"
"1502","80  >  52405 [PSH, ACK] Seq=96497 Ack=432 Win=64240 Len=1448 [TCP segment of a reassembled PDU]"
"1502","80  >  52405 [PSH, ACK] Seq=97945 Ack=432 Win=64240 Len=1448 [TCP segment of a reassembled PDU]"
"1502","80  >  52405 [PSH, ACK] Seq=99393 Ack=432 Win=64240 Len=1448 [TCP segment of a reassembled PDU]"
"54","52405  >  80 [ACK] Seq=432 Ack=100841 Win=64240 Len=0"
"1502","80  >  52405 [PSH, ACK] Seq=100841 Ack=432 Win=64240 Len=1448 [TCP segment of a reassembled PDU]"
"1502","80  >  52405 [PSH, ACK] Seq=102289 Ack=432 Win=64240 Len=1448 [TCP segment of a reassembled PDU]"
"54","52405  >  80 [ACK] Seq=432 Ack=103737 Win=64240 Len=0"
"1502","80  >  52405 [PSH, ACK] Seq=103737 Ack=432 Win=64240 Len=1448 [TCP segment of a reassembled PDU]"
"1502","80  >  52405 [PSH, ACK] Seq=105185 Ack=432 Win=64240 Len=1448 [TCP segment of a reassembled PDU]"
"54","52405  >  80 [ACK] Seq=432 Ack=106633 Win=64240 Len=0"
"1502","80  >  52405 [PSH, ACK] Seq=106633 Ack=432 Win=64240 Len=1448 [TCP segment of a reassembled PDU]"
"1502","80  >  52405 [PSH, ACK] Seq=108081 Ack=432 Win=64240 Len=1448 [TCP segment of a reassembled PDU]"
"54","52405  >  80 [ACK] Seq=432 Ack=109529 Win=64240 Len=0"
"1502","80  >  52405 [PSH, ACK] Seq=109529 Ack=432 Win=64240 Len=1448 [TCP segment of a reassembled PDU]"
"1502","80  >  52405 [PSH, ACK] Seq=110977 Ack=432 Win=64240 Len=1448 [TCP segment of a reassembled PDU]"
"54","52405  >  80 [ACK] Seq=432 Ack=112425 Win=64240 Len=0"
"1514","80  >  52405 [ACK] Seq=112425 Ack=432 Win=64240 Len=1460 [TCP segment of a reassembled PDU]"
"1514","80  >  52405 [ACK] Seq=113885 Ack=432 Win=64240 Len=1460 [TCP segment of a reassembled PDU]"
"1514","80  >  52405 [ACK] Seq=115345 Ack=432 Win=64240 Len=1460 [TCP segment of a reassembled PDU]"
"1466","80  >  52405 [PSH, ACK] Seq=116805 Ack=432 Win=64240 Len=1412 [TCP segment of a reassembled PDU]"
"54","52405  >  80 [ACK] Seq=432 Ack=118217 Win=64240 Len=0"
"1502","80  >  52405 [PSH, ACK] Seq=118217 Ack=432 Win=64240 Len=1448 [TCP segment of a reassembled PDU]"
"1514","80  >  52405 [ACK] Seq=119665 Ack=432 Win=64240 Len=1460 [TCP segment of a reassembled PDU]"
"1514","80  >  52405 [ACK] Seq=121125 Ack=432 Win=64240 Len=1460 [TCP segment of a reassembled PDU]"
"1478","80  >  52405 [PSH, ACK] Seq=122585 Ack=432 Win=64240 Len=1424 [TCP segment of a reassembled PDU]"
"54","52405  >  80 [ACK] Seq=432 Ack=124009 Win=64240 Len=0"
"1502","80  >  52405 [PSH, ACK] Seq=124009 Ack=432 Win=64240 Len=1448 [TCP segment of a reassembled PDU]"
"1514","80  >  52405 [ACK] Seq=125457 Ack=432 Win=64240 Len=1460 [TCP segment of a reassembled PDU]"
"1490","80  >  52405 [PSH, ACK] Seq=126917 Ack=432 Win=64240 Len=1436 [TCP segment of a reassembled PDU]"
"54","52405  >  80 [ACK] Seq=432 Ack=128353 Win=64240 Len=0"
"1502","80  >  52405 [PSH, ACK] Seq=128353 Ack=432 Win=64240 Len=1448 [TCP segment of a reassembled PDU]"
"1502","80  >  52405 [PSH, ACK] Seq=129801 Ack=432 Win=64240 Len=1448 [TCP segment of a reassembled PDU]"
"54","52405  >  80 [ACK] Seq=432 Ack=131249 Win=64240 Len=0"
"1502","80  >  52405 [PSH, ACK] Seq=131249 Ack=432 Win=64240 Len=1448 [TCP segment of a reassembled PDU]"
"1502","[TCP Retransmission] 80  >  52405 [PSH, ACK] Seq=131249 Ack=432 Win=64240 Len=1448"
"54","52405  >  80 [ACK] Seq=432 Ack=132697 Win=62792 Len=0"
"1514","80  >  52405 [ACK] Seq=132697 Ack=432 Win=64240 Len=1460 [TCP segment of a reassembled PDU]"
"1514","80  >  52405 [ACK] Seq=134157 Ack=432 Win=64240 Len=1460 [TCP segment of a reassembled PDU]"
"1514","80  >  52405 [ACK] Seq=135617 Ack=432 Win=64240 Len=1460 [TCP segment of a reassembled PDU]"
"1514","80  >  52405 [ACK] Seq=137077 Ack=432 Win=64240 Len=1460 [TCP segment of a reassembled PDU]"
"1514","80  >  52405 [ACK] Seq=138537 Ack=432 Win=64240 Len=1460 [TCP segment of a reassembled PDU]"
"1514","80  >  52405 [ACK] Seq=139997 Ack=432 Win=64240 Len=1460 [TCP segment of a reassembled PDU]"
"1514","80  >  52405 [ACK] Seq=141457 Ack=432 Win=64240 Len=1460 [TCP segment of a reassembled PDU]"
"1418","80  >  52405 [PSH, ACK] Seq=142917 Ack=432 Win=64240 Len=1364 [TCP segment of a reassembled PDU]"
"54","52405  >  80 [ACK] Seq=432 Ack=144281 Win=61416 Len=0"
"54","[TCP Window Update] 52405  >  80 [ACK] Seq=432 Ack=144281 Win=64240 Len=0"
"1502","80  >  52405 [PSH, ACK] Seq=144281 Ack=432 Win=64240 Len=1448 [TCP segment of a reassembled PDU]"
"1502","80  >  52405 [PSH, ACK] Seq=145729 Ack=432 Win=64240 Len=1448 [TCP segment of a reassembled PDU]"
"54","52405  >  80 [ACK] Seq=432 Ack=147177 Win=64240 Len=0"
"1502","80  >  52405 [PSH, ACK] Seq=147177 Ack=432 Win=64240 Len=1448 [TCP segment of a reassembled PDU]"
"1502","80  >  52405 [PSH, ACK] Seq=148625 Ack=432 Win=64240 Len=1448 [TCP segment of a reassembled PDU]"
"54","52405  >  80 [ACK] Seq=432 Ack=150073 Win=64240 Len=0"
"1502","80  >  52405 [PSH, ACK] Seq=150073 Ack=432 Win=64240 Len=1448 [TCP segment of a reassembled PDU]"
"1502","80  >  52405 [PSH, ACK] Seq=151521 Ack=432 Win=64240 Len=1448 [TCP segment of a reassembled PDU]"
"54","52405  >  80 [ACK] Seq=432 Ack=152969 Win=64240 Len=0"
"1502","80  >  52405 [PSH, ACK] Seq=152969 Ack=432 Win=64240 Len=1448 [TCP segment of a reassembled PDU]"
"1502","80  >  52405 [PSH, ACK] Seq=154417 Ack=432 Win=64240 Len=1448 [TCP segment of a reassembled PDU]"
"54","52405  >  80 [ACK] Seq=432 Ack=155865 Win=64240 Len=0"
"1502","80  >  52405 [PSH, ACK] Seq=155865 Ack=432 Win=64240 Len=1448 [TCP segment of a reassembled PDU]"
"1502","80  >  52405 [PSH, ACK] Seq=157313 Ack=432 Win=64240 Len=1448 [TCP segment of a reassembled PDU]"
"54","52405  >  80 [ACK] Seq=432 Ack=158761 Win=64240 Len=0"
"1502","80  >  52405 [PSH, ACK] Seq=158761 Ack=432 Win=64240 Len=1448 [TCP segment of a reassembled PDU]"
"1502","80  >  52405 [PSH, ACK] Seq=160209 Ack=432 Win=64240 Len=1448 [TCP segment of a reassembled PDU]"
"54","52405  >  80 [ACK] Seq=432 Ack=161657 Win=64240 Len=0"
"1502","80  >  52405 [PSH, ACK] Seq=161657 Ack=432 Win=64240 Len=1448 [TCP segment of a reassembled PDU]"
"1502","80  >  52405 [PSH, ACK] Seq=163105 Ack=432 Win=64240 Len=1448 [TCP segment of a reassembled PDU]"
"54","52405  >  80 [ACK] Seq=432 Ack=164553 Win=64240 Len=0"
"1502","80  >  52405 [PSH, ACK] Seq=164553 Ack=432 Win=64240 Len=1448 [TCP segment of a reassembled PDU]"
"1502","80  >  52405 [PSH, ACK] Seq=166001 Ack=432 Win=64240 Len=1448 [TCP segment of a reassembled PDU]"
"54","52405  >  80 [ACK] Seq=432 Ack=167449 Win=64240 Len=0"
"1502","80  >  52405 [PSH, ACK] Seq=167449 Ack=432 Win=64240 Len=1448 [TCP segment of a reassembled PDU]"
"1502","80  >  52405 [PSH, ACK] Seq=168897 Ack=432 Win=64240 Len=1448 [TCP segment of a reassembled PDU]"
"54","52405  >  80 [ACK] Seq=432 Ack=170345 Win=64240 Len=0"
"1502","80  >  52405 [PSH, ACK] Seq=170345 Ack=432 Win=64240 Len=1448 [TCP segment of a reassembled PDU]"
"1502","80  >  52405 [PSH, ACK] Seq=171793 Ack=432 Win=64240 Len=1448 [TCP segment of a reassembled PDU]"
"54","52405  >  80 [ACK] Seq=432 Ack=173241 Win=64240 Len=0"
"1502","80  >  52405 [PSH, ACK] Seq=173241 Ack=432 Win=64240 Len=1448 [TCP segment of a reassembled PDU]"
"1502","80  >  52405 [PSH, ACK] Seq=174689 Ack=432 Win=64240 Len=1448 [TCP segment of a reassembled PDU]"
"54","52405  >  80 [ACK] Seq=432 Ack=176137 Win=64240 Len=0"
"1514","80  >  52405 [ACK] Seq=176137 Ack=432 Win=64240 Len=1460 [TCP segment of a reassembled PDU]"
"1514","80  >  52405 [ACK] Seq=177597 Ack=432 Win=64240 Len=1460 [TCP segment of a reassembled PDU]"
"1514","80  >  52405 [ACK] Seq=179057 Ack=432 Win=64240 Len=1460 [TCP segment of a reassembled PDU]"
"1514","80  >  52405 [ACK] Seq=180517 Ack=432 Win=64240 Len=1460 [TCP segment of a reassembled PDU]"
"1514","80  >  52405 [ACK] Seq=181977 Ack=432 Win=64240 Len=1460 [TCP segment of a reassembled PDU]"
"1514","80  >  52405 [ACK] Seq=183437 Ack=432 Win=64240 Len=1460 [TCP segment of a reassembled PDU]"
"1514","80  >  52405 [ACK] Seq=184897 Ack=432 Win=64240 Len=1460 [TCP segment of a reassembled PDU]"
"1418","80  >  52405 [PSH, ACK] Seq=186357 Ack=432 Win=64240 Len=1364 [TCP segment of a reassembled PDU]"
"54","52405  >  80 [ACK] Seq=432 Ack=187721 Win=61416 Len=0"
"54","[TCP Window Update] 52405  >  80 [ACK] Seq=432 Ack=187721 Win=64240 Len=0"
"1502","80  >  52405 [PSH, ACK] Seq=187721 Ack=432 Win=64240 Len=1448 [TCP segment of a reassembled PDU]"
"1502","[TCP Retransmission] 80  >  52405 [PSH, ACK] Seq=187721 Ack=432 Win=64240 Len=1448"
"54","52405  >  80 [ACK] Seq=432 Ack=189169 Win=62792 Len=0"
"1514","80  >  52405 [ACK] Seq=189169 Ack=432 Win=64240 Len=1460 [TCP segment of a reassembled PDU]"
"1514","80  >  52405 [ACK] Seq=190629 Ack=432 Win=64240 Len=1460 [TCP segment of a reassembled PDU]"
"1514","80  >  52405 [ACK] Seq=192089 Ack=432 Win=64240 Len=1460 [TCP segment of a reassembled PDU]"
"1514","80  >  52405 [ACK] Seq=193549 Ack=432 Win=64240 Len=1460 [TCP segment of a reassembled PDU]"
"1514","80  >  52405 [ACK] Seq=195009 Ack=432 Win=64240 Len=1460 [TCP segment of a reassembled PDU]"
"1514","80  >  52405 [ACK] Seq=196469 Ack=432 Win=64240 Len=1460 [TCP segment of a reassembled PDU]"
"1514","80  >  52405 [ACK] Seq=197929 Ack=432 Win=64240 Len=1460 [TCP segment of a reassembled PDU]"
"1418","80  >  52405 [PSH, ACK] Seq=199389 Ack=432 Win=64240 Len=1364 [TCP segment of a reassembled PDU]"
"54","52405  >  80 [ACK] Seq=432 Ack=200753 Win=61416 Len=0"
"54","[TCP Window Update] 52405  >  80 [ACK] Seq=432 Ack=200753 Win=64240 Len=0"
"1502","80  >  52405 [PSH, ACK] Seq=200753 Ack=432 Win=64240 Len=1448 [TCP segment of a reassembled PDU]"
"1502","80  >  52405 [PSH, ACK] Seq=202201 Ack=432 Win=64240 Len=1448 [TCP segment of a reassembled PDU]"
"54","52405  >  80 [ACK] Seq=432 Ack=203649 Win=64240 Len=0"
"1502","80  >  52405 [PSH, ACK] Seq=203649 Ack=432 Win=64240 Len=1448 [TCP segment of a reassembled PDU]"
"1502","80  >  52405 [PSH, ACK] Seq=205097 Ack=432 Win=64240 Len=1448 [TCP segment of a reassembled PDU]"
"54","52405  >  80 [ACK] Seq=432 Ack=206545 Win=64240 Len=0"
"1502","80  >  52405 [PSH, ACK] Seq=206545 Ack=432 Win=64240 Len=1448 [TCP segment of a reassembled PDU]"
"1502","80  >  52405 [PSH, ACK] Seq=207993 Ack=432 Win=64240 Len=1448 [TCP segment of a reassembled PDU]"
"54","52405  >  80 [ACK] Seq=432 Ack=209441 Win=64240 Len=0"
"1502","80  >  52405 [PSH, ACK] Seq=209441 Ack=432 Win=64240 Len=1448 [TCP segment of a reassembled PDU]"
"1502","80  >  52405 [PSH, ACK] Seq=210889 Ack=432 Win=64240 Len=1448 [TCP segment of a reassembled PDU]"
"54","52405  >  80 [ACK] Seq=432 Ack=212337 Win=64240 Len=0"
"1502","80  >  52405 [PSH, ACK] Seq=212337 Ack=432 Win=64240 Len=1448 [TCP segment of a reassembled PDU]"
"1502","80  >  52405 [PSH, ACK] Seq=213785 Ack=432 Win=64240 Len=1448 [TCP segment of a reassembled PDU]"
"54","52405  >  80 [ACK] Seq=432 Ack=215233 Win=64240 Len=0"
"1502","80  >  52405 [PSH, ACK] Seq=215233 Ack=432 Win=64240 Len=1448 [TCP segment of a reassembled PDU]"
"1502","80  >  52405 [PSH, ACK] Seq=216681 Ack=432 Win=64240 Len=1448 [TCP segment of a reassembled PDU]"
"54","52405  >  80 [ACK] Seq=432 Ack=218129 Win=64240 Len=0"
"1502","80  >  52405 [PSH, ACK] Seq=218129 Ack=432 Win=64240 Len=1448 [TCP segment of a reassembled PDU]"
"1502","80  >  52405 [PSH, ACK] Seq=219577 Ack=432 Win=64240 Len=1448 [TCP segment of a reassembled PDU]"
"54","52405  >  80 [ACK] Seq=432 Ack=221025 Win=64240 Len=0"
"1502","80  >  52405 [PSH, ACK] Seq=221025 Ack=432 Win=64240 Len=1448 [TCP segment of a reassembled PDU]"
"1502","80  >  52405 [PSH, ACK] Seq=222473 Ack=432 Win=64240 Len=1448 [TCP segment of a reassembled PDU]"
"54","52405  >  80 [ACK] Seq=432 Ack=223921 Win=64240 Len=0"
"1502","80  >  52405 [PSH, ACK] Seq=223921 Ack=432 Win=64240 Len=1448 [TCP segment of a reassembled PDU]"
"1502","80  >  52405 [PSH, ACK] Seq=225369 Ack=432 Win=64240 Len=1448 [TCP segment of a reassembled PDU]"
"54","52405  >  80 [ACK] Seq=432 Ack=226817 Win=64240 Len=0"
"1502","80  >  52405 [PSH, ACK] Seq=226817 Ack=432 Win=64240 Len=1448 [TCP segment of a reassembled PDU]"
"1502","80  >  52405 [PSH, ACK] Seq=228265 Ack=432 Win=64240 Len=1448 [TCP segment of a reassembled PDU]"
"54","52405  >  80 [ACK] Seq=432 Ack=229713 Win=64240 Len=0"
"1502","80  >  52405 [PSH, ACK] Seq=229713 Ack=432 Win=64240 Len=1448 [TCP segment of a reassembled PDU]"
"1502","80  >  52405 [PSH, ACK] Seq=231161 Ack=432 Win=64240 Len=1448 [TCP segment of a reassembled PDU]"
"54","52405  >  80 [ACK] Seq=432 Ack=232609 Win=64240 Len=0"
"1502","80  >  52405 [PSH, ACK] Seq=232609 Ack=432 Win=64240 Len=1448 [TCP segment of a reassembled PDU]"
"1502","80  >  52405 [PSH, ACK] Seq=234057 Ack=432 Win=64240 Len=1448 [TCP segment of a reassembled PDU]"
"54","52405  >  80 [ACK] Seq=432 Ack=235505 Win=64240 Len=0"
"1502","80  >  52405 [PSH, ACK] Seq=235505 Ack=432 Win=64240 Len=1448 [TCP segment of a reassembled PDU]"
"1502","80  >  52405 [PSH, ACK] Seq=236953 Ack=432 Win=64240 Len=1448 [TCP segment of a reassembled PDU]"
"54","52405  >  80 [ACK] Seq=432 Ack=238401 Win=64240 Len=0"
"1514","80  >  52405 [ACK] Seq=238401 Ack=432 Win=64240 Len=1460 [TCP segment of a reassembled PDU]"
"1514","80  >  52405 [ACK] Seq=239861 Ack=432 Win=64240 Len=1460 [TCP segment of a reassembled PDU]"
"1514","80  >  52405 [ACK] Seq=241321 Ack=432 Win=64240 Len=1460 [TCP segment of a reassembled PDU]"
"1514","80  >  52405 [ACK] Seq=242781 Ack=432 Win=64240 Len=1460 [TCP segment of a reassembled PDU]"
"1514","80  >  52405 [ACK] Seq=244241 Ack=432 Win=64240 Len=1460 [TCP segment of a reassembled PDU]"
"1514","80  >  52405 [ACK] Seq=245701 Ack=432 Win=64240 Len=1460 [TCP segment of a reassembled PDU]"
"1514","80  >  52405 [ACK] Seq=247161 Ack=432 Win=64240 Len=1460 [TCP segment of a reassembled PDU]"
"1418","80  >  52405 [PSH, ACK] Seq=248621 Ack=432 Win=64240 Len=1364 [TCP segment of a reassembled PDU]"
"54","52405  >  80 [ACK] Seq=432 Ack=249985 Win=61416 Len=0"
"1502","80  >  52405 [PSH, ACK] Seq=249985 Ack=432 Win=64240 Len=1448 [TCP segment of a reassembled PDU]"
"54","52405  >  80 [ACK] Seq=432 Ack=251433 Win=64240 Len=0"
"1502","80  >  52405 [PSH, ACK] Seq=251433 Ack=432 Win=64240 Len=1448 [TCP segment of a reassembled PDU]"
"1502","80  >  52405 [PSH, ACK] Seq=252881 Ack=432 Win=64240 Len=1448 [TCP segment of a reassembled PDU]"
"54","52405  >  80 [ACK] Seq=432 Ack=254329 Win=64240 Len=0"
"1502","80  >  52405 [PSH, ACK] Seq=254329 Ack=432 Win=64240 Len=1448 [TCP segment of a reassembled PDU]"
"1502","80  >  52405 [PSH, ACK] Seq=255777 Ack=432 Win=64240 Len=1448 [TCP segment of a reassembled PDU]"
"54","52405  >  80 [ACK] Seq=432 Ack=257225 Win=64240 Len=0"
"1502","80  >  52405 [PSH, ACK] Seq=257225 Ack=432 Win=64240 Len=1448 [TCP segment of a reassembled PDU]"
"1502","80  >  52405 [PSH, ACK] Seq=258673 Ack=432 Win=64240 Len=1448 [TCP segment of a reassembled PDU]"
"54","52405  >  80 [ACK] Seq=432 Ack=260121 Win=64240 Len=0"
"1502","80  >  52405 [PSH, ACK] Seq=260121 Ack=432 Win=64240 Len=1448 [TCP segment of a reassembled PDU]"
"1514","80  >  52405 [ACK] Seq=261569 Ack=432 Win=64240 Len=1460 [TCP segment of a reassembled PDU]"
"1490","80  >  52405 [PSH, ACK] Seq=263029 Ack=432 Win=64240 Len=1436 [TCP segment of a reassembled PDU]"
"54","52405  >  80 [ACK] Seq=432 Ack=264465 Win=64240 Len=0"
"1502","80  >  52405 [PSH, ACK] Seq=264465 Ack=432 Win=64240 Len=1448 [TCP segment of a reassembled PDU]"
"1502","80  >  52405 [PSH, ACK] Seq=265913 Ack=432 Win=64240 Len=1448 [TCP segment of a reassembled PDU]"
"54","52405  >  80 [ACK] Seq=432 Ack=267361 Win=64240 Len=0"
"1502","80  >  52405 [PSH, ACK] Seq=267361 Ack=432 Win=64240 Len=1448 [TCP segment of a reassembled PDU]"
"1502","80  >  52405 [PSH, ACK] Seq=268809 Ack=432 Win=64240 Len=1448 [TCP segment of a reassembled PDU]"
"54","52405  >  80 [ACK] Seq=432 Ack=270257 Win=64240 Len=0"
"1502","80  >  52405 [PSH, ACK] Seq=270257 Ack=432 Win=64240 Len=1448 [TCP segment of a reassembled PDU]"
"1502","80  >  52405 [PSH, ACK] Seq=271705 Ack=432 Win=64240 Len=1448 [TCP segment of a reassembled PDU]"
"54","52405  >  80 [ACK] Seq=432 Ack=273153 Win=64240 Len=0"
"1502","80  >  52405 [PSH, ACK] Seq=273153 Ack=432 Win=64240 Len=1448 [TCP segment of a reassembled PDU]"
"1502","80  >  52405 [PSH, ACK] Seq=274601 Ack=432 Win=64240 Len=1448 [TCP segment of a reassembled PDU]"
"54","52405  >  80 [ACK] Seq=432 Ack=276049 Win=64240 Len=0"
"1502","80  >  52405 [PSH, ACK] Seq=276049 Ack=432 Win=64240 Len=1448 [TCP segment of a reassembled PDU]"
"1502","80  >  52405 [PSH, ACK] Seq=277497 Ack=432 Win=64240 Len=1448 [TCP segment of a reassembled PDU]"
"1502","80  >  52405 [PSH, ACK] Seq=278945 Ack=432 Win=64240 Len=1448 [TCP segment of a reassembled PDU]"
"54","52405  >  80 [ACK] Seq=432 Ack=280393 Win=64240 Len=0"
"1514","80  >  52405 [ACK] Seq=280393 Ack=432 Win=64240 Len=1460 [TCP segment of a reassembled PDU]"
"1490","80  >  52405 [PSH, ACK] Seq=281853 Ack=432 Win=64240 Len=1436 [TCP segment of a reassembled PDU]"
"54","52405  >  80 [ACK] Seq=432 Ack=283289 Win=64240 Len=0"
"1502","80  >  52405 [PSH, ACK] Seq=283289 Ack=432 Win=64240 Len=1448 [TCP segment of a reassembled PDU]"
"1502","80  >  52405 [PSH, ACK] Seq=284737 Ack=432 Win=64240 Len=1448 [TCP segment of a reassembled PDU]"
"54","52405  >  80 [ACK] Seq=432 Ack=286185 Win=64240 Len=0"
"1502","80  >  52405 [PSH, ACK] Seq=286185 Ack=432 Win=64240 Len=1448 [TCP segment of a reassembled PDU]"
"1502","80  >  52405 [PSH, ACK] Seq=287633 Ack=432 Win=64240 Len=1448 [TCP segment of a reassembled PDU]"
"54","52405  >  80 [ACK] Seq=432 Ack=289081 Win=64240 Len=0"
"1514","80  >  52405 [ACK] Seq=289081 Ack=432 Win=64240 Len=1460 [TCP segment of a reassembled PDU]"
"1490","80  >  52405 [PSH, ACK] Seq=290541 Ack=432 Win=64240 Len=1436 [TCP segment of a reassembled PDU]"
"54","52405  >  80 [ACK] Seq=432 Ack=291977 Win=64240 Len=0"
"1502","80  >  52405 [PSH, ACK] Seq=291977 Ack=432 Win=64240 Len=1448 [TCP segment of a reassembled PDU]"
"1502","80  >  52405 [PSH, ACK] Seq=293425 Ack=432 Win=64240 Len=1448 [TCP segment of a reassembled PDU]"
"54","52405  >  80 [ACK] Seq=432 Ack=294873 Win=64240 Len=0"
"1502","80  >  52405 [PSH, ACK] Seq=294873 Ack=432 Win=64240 Len=1448 [TCP segment of a reassembled PDU]"
"1502","80  >  52405 [PSH, ACK] Seq=296321 Ack=432 Win=64240 Len=1448 [TCP segment of a reassembled PDU]"
"54","52405  >  80 [ACK] Seq=432 Ack=297769 Win=64240 Len=0"
"1502","80  >  52405 [PSH, ACK] Seq=297769 Ack=432 Win=64240 Len=1448 [TCP segment of a reassembled PDU]"
"1502","80  >  52405 [PSH, ACK] Seq=299217 Ack=432 Win=64240 Len=1448 [TCP segment of a reassembled PDU]"
"54","52405  >  80 [ACK] Seq=432 Ack=300665 Win=64240 Len=0"
"1502","80  >  52405 [PSH, ACK] Seq=300665 Ack=432 Win=64240 Len=1448 [TCP segment of a reassembled PDU]"
"1502","80  >  52405 [PSH, ACK] Seq=302113 Ack=432 Win=64240 Len=1448 [TCP segment of a reassembled PDU]"
"54","52405  >  80 [ACK] Seq=432 Ack=303561 Win=64240 Len=0"
"1502","80  >  52405 [PSH, ACK] Seq=303561 Ack=432 Win=64240 Len=1448 [TCP segment of a reassembled PDU]"
"1502","80  >  52405 [PSH, ACK] Seq=305009 Ack=432 Win=64240 Len=1448 [TCP segment of a reassembled PDU]"
"54","52405  >  80 [ACK] Seq=432 Ack=306457 Win=64240 Len=0"
"1502","80  >  52405 [PSH, ACK] Seq=306457 Ack=432 Win=64240 Len=1448 [TCP segment of a reassembled PDU]"
"1502","[TCP Retransmission] 80  >  52405 [PSH, ACK] Seq=306457 Ack=432 Win=64240 Len=1448"
"54","52405  >  80 [ACK] Seq=432 Ack=307905 Win=62792 Len=0"
"1514","80  >  52405 [ACK] Seq=307905 Ack=432 Win=64240 Len=1460 [TCP segment of a reassembled PDU]"
"1514","80  >  52405 [ACK] Seq=309365 Ack=432 Win=64240 Len=1460 [TCP segment of a reassembled PDU]"
"1514","80  >  52405 [ACK] Seq=310825 Ack=432 Win=64240 Len=1460 [TCP segment of a reassembled PDU]"
"1514","80  >  52405 [ACK] Seq=312285 Ack=432 Win=64240 Len=1460 [TCP segment of a reassembled PDU]"
"1514","80  >  52405 [ACK] Seq=313745 Ack=432 Win=64240 Len=1460 [TCP segment of a reassembled PDU]"
"1514","80  >  52405 [ACK] Seq=315205 Ack=432 Win=64240 Len=1460 [TCP segment of a reassembled PDU]"
"1514","80  >  52405 [ACK] Seq=316665 Ack=432 Win=64240 Len=1460 [TCP segment of a reassembled PDU]"
"1514","80  >  52405 [ACK] Seq=318125 Ack=432 Win=64240 Len=1460 [TCP segment of a reassembled PDU]"
"1514","80  >  52405 [ACK] Seq=319585 Ack=432 Win=64240 Len=1460 [TCP segment of a reassembled PDU]"
"1514","80  >  52405 [ACK] Seq=321045 Ack=432 Win=64240 Len=1460 [TCP segment of a reassembled PDU]"
"1514","80  >  52405 [ACK] Seq=322505 Ack=432 Win=64240 Len=1460 [TCP segment of a reassembled PDU]"
"1370","80  >  52405 [PSH, ACK] Seq=323965 Ack=432 Win=64240 Len=1316 [TCP segment of a reassembled PDU]"
"54","52405  >  80 [ACK] Seq=432 Ack=325281 Win=55624 Len=0"
"54","[TCP Window Update] 52405  >  80 [ACK] Seq=432 Ack=325281 Win=64240 Len=0"
"1502","80  >  52405 [PSH, ACK] Seq=325281 Ack=432 Win=64240 Len=1448 [TCP segment of a reassembled PDU]"
"1502","80  >  52405 [PSH, ACK] Seq=326729 Ack=432 Win=64240 Len=1448 [TCP segment of a reassembled PDU]"
"54","52405  >  80 [ACK] Seq=432 Ack=328177 Win=64240 Len=0"
"1502","80  >  52405 [PSH, ACK] Seq=328177 Ack=432 Win=64240 Len=1448 [TCP segment of a reassembled PDU]"
"1514","80  >  52405 [ACK] Seq=329625 Ack=432 Win=64240 Len=1460 [TCP segment of a reassembled PDU]"
"54","52405  >  80 [ACK] Seq=432 Ack=331085 Win=64240 Len=0"
"1490","80  >  52405 [PSH, ACK] Seq=331085 Ack=432 Win=64240 Len=1436 [TCP segment of a reassembled PDU]"
"1502","80  >  52405 [PSH, ACK] Seq=332521 Ack=432 Win=64240 Len=1448 [TCP segment of a reassembled PDU]"
"54","52405  >  80 [ACK] Seq=432 Ack=333969 Win=64240 Len=0"
"1502","80  >  52405 [PSH, ACK] Seq=333969 Ack=432 Win=64240 Len=1448 [TCP segment of a reassembled PDU]"
"1502","80  >  52405 [PSH, ACK] Seq=335417 Ack=432 Win=64240 Len=1448 [TCP segment of a reassembled PDU]"
"1502","80  >  52405 [PSH, ACK] Seq=336865 Ack=432 Win=64240 Len=1448 [TCP segment of a reassembled PDU]"
"54","52405  >  80 [ACK] Seq=432 Ack=338313 Win=64240 Len=0"
"1502","80  >  52405 [PSH, ACK] Seq=338313 Ack=432 Win=64240 Len=1448 [TCP segment of a reassembled PDU]"
"1502","80  >  52405 [PSH, ACK] Seq=339761 Ack=432 Win=64240 Len=1448 [TCP segment of a reassembled PDU]"
"54","52405  >  80 [ACK] Seq=432 Ack=341209 Win=64240 Len=0"
"1514","80  >  52405 [ACK] Seq=341209 Ack=432 Win=64240 Len=1460 [TCP segment of a reassembled PDU]"
"1490","80  >  52405 [PSH, ACK] Seq=342669 Ack=432 Win=64240 Len=1436 [TCP segment of a reassembled PDU]"
"54","52405  >  80 [ACK] Seq=432 Ack=344105 Win=64240 Len=0"
"1514","80  >  52405 [ACK] Seq=344105 Ack=432 Win=64240 Len=1460 [TCP segment of a reassembled PDU]"
"1490","80  >  52405 [PSH, ACK] Seq=345565 Ack=432 Win=64240 Len=1436 [TCP segment of a reassembled PDU]"
"54","52405  >  80 [ACK] Seq=432 Ack=347001 Win=64240 Len=0"
"1502","80  >  52405 [PSH, ACK] Seq=347001 Ack=432 Win=64240 Len=1448 [TCP segment of a reassembled PDU]"
"1514","80  >  52405 [ACK] Seq=348449 Ack=432 Win=64240 Len=1460 [TCP segment of a reassembled PDU]"
"1490","80  >  52405 [PSH, ACK] Seq=349909 Ack=432 Win=64240 Len=1436 [TCP segment of a reassembled PDU]"
"1502","80  >  52405 [PSH, ACK] Seq=351345 Ack=432 Win=64240 Len=1448 [TCP segment of a reassembled PDU]"
"54","52405  >  80 [ACK] Seq=432 Ack=352793 Win=64240 Len=0"
"1502","80  >  52405 [PSH, ACK] Seq=352793 Ack=432 Win=64240 Len=1448 [TCP segment of a reassembled PDU]"
"1502","80  >  52405 [PSH, ACK] Seq=354241 Ack=432 Win=64240 Len=1448 [TCP segment of a reassembled PDU]"
"54","52405  >  80 [ACK] Seq=432 Ack=355689 Win=64240 Len=0"
"1502","80  >  52405 [PSH, ACK] Seq=355689 Ack=432 Win=64240 Len=1448 [TCP segment of a reassembled PDU]"
"1502","80  >  52405 [PSH, ACK] Seq=357137 Ack=432 Win=64240 Len=1448 [TCP segment of a reassembled PDU]"
"54","52405  >  80 [ACK] Seq=432 Ack=358585 Win=64240 Len=0"
"1502","80  >  52405 [PSH, ACK] Seq=358585 Ack=432 Win=64240 Len=1448 [TCP segment of a reassembled PDU]"
"1502","80  >  52405 [PSH, ACK] Seq=360033 Ack=432 Win=64240 Len=1448 [TCP segment of a reassembled PDU]"
"54","52405  >  80 [ACK] Seq=432 Ack=361481 Win=64240 Len=0"
"1514","80  >  52405 [ACK] Seq=361481 Ack=432 Win=64240 Len=1460 [TCP segment of a reassembled PDU]"
"1514","80  >  52405 [ACK] Seq=362941 Ack=432 Win=64240 Len=1460 [TCP segment of a reassembled PDU]"
"1514","80  >  52405 [ACK] Seq=364401 Ack=432 Win=64240 Len=1460 [TCP segment of a reassembled PDU]"
"1514","80  >  52405 [ACK] Seq=365861 Ack=432 Win=64240 Len=1460 [TCP segment of a reassembled PDU]"
"1514","80  >  52405 [ACK] Seq=367321 Ack=432 Win=64240 Len=1460 [TCP segment of a reassembled PDU]"
"1514","80  >  52405 [ACK] Seq=368781 Ack=432 Win=64240 Len=1460 [TCP segment of a reassembled PDU]"
"1514","80  >  52405 [ACK] Seq=370241 Ack=432 Win=64240 Len=1460 [TCP segment of a reassembled PDU]"
"1514","80  >  52405 [ACK] Seq=371701 Ack=432 Win=64240 Len=1460 [TCP segment of a reassembled PDU]"
"1514","80  >  52405 [ACK] Seq=373161 Ack=432 Win=64240 Len=1460 [TCP segment of a reassembled PDU]"
"1394","80  >  52405 [PSH, ACK] Seq=374621 Ack=432 Win=64240 Len=1340 [TCP segment of a reassembled PDU]"
"54","52405  >  80 [ACK] Seq=432 Ack=375961 Win=58520 Len=0"
"54","[TCP Window Update] 52405  >  80 [ACK] Seq=432 Ack=375961 Win=64240 Len=0"
"1514","80  >  52405 [ACK] Seq=375961 Ack=432 Win=64240 Len=1460 [TCP segment of a reassembled PDU]"
"1514","80  >  52405 [ACK] Seq=377421 Ack=432 Win=64240 Len=1460 [TCP segment of a reassembled PDU]"
"1514","80  >  52405 [ACK] Seq=378881 Ack=432 Win=64240 Len=1460 [TCP segment of a reassembled PDU]"
"1466","80  >  52405 [PSH, ACK] Seq=380341 Ack=432 Win=64240 Len=1412 [TCP segment of a reassembled PDU]"
"54","52405  >  80 [ACK] Seq=432 Ack=381753 Win=64240 Len=0"
"1502","80  >  52405 [PSH, ACK] Seq=381753 Ack=432 Win=64240 Len=1448 [TCP segment of a reassembled PDU]"
"1502","80  >  52405 [PSH, ACK] Seq=383201 Ack=432 Win=64240 Len=1448 [TCP segment of a reassembled PDU]"
"54","52405  >  80 [ACK] Seq=432 Ack=384649 Win=64240 Len=0"
"1502","80  >  52405 [PSH, ACK] Seq=384649 Ack=432 Win=64240 Len=1448 [TCP segment of a reassembled PDU]"
"1502","80  >  52405 [PSH, ACK] Seq=386097 Ack=432 Win=64240 Len=1448 [TCP segment of a reassembled PDU]"
"54","52405  >  80 [ACK] Seq=432 Ack=387545 Win=64240 Len=0"
"1502","80  >  52405 [PSH, ACK] Seq=387545 Ack=432 Win=64240 Len=1448 [TCP segment of a reassembled PDU]"
"1502","80  >  52405 [PSH, ACK] Seq=388993 Ack=432 Win=64240 Len=1448 [TCP segment of a reassembled PDU]"
"54","52405  >  80 [ACK] Seq=432 Ack=390441 Win=64240 Len=0"
"1514","80  >  52405 [ACK] Seq=390441 Ack=432 Win=64240 Len=1460 [TCP segment of a reassembled PDU]"
"1490","80  >  52405 [PSH, ACK] Seq=391901 Ack=432 Win=64240 Len=1436 [TCP segment of a reassembled PDU]"
"54","52405  >  80 [ACK] Seq=432 Ack=393337 Win=64240 Len=0"
"1502","80  >  52405 [PSH, ACK] Seq=393337 Ack=432 Win=64240 Len=1448 [TCP segment of a reassembled PDU]"
"1514","80  >  52405 [ACK] Seq=394785 Ack=432 Win=64240 Len=1460 [TCP segment of a reassembled PDU]"
"1514","80  >  52405 [ACK] Seq=396245 Ack=432 Win=64240 Len=1460 [TCP segment of a reassembled PDU]"
"1514","80  >  52405 [ACK] Seq=397705 Ack=432 Win=64240 Len=1460 [TCP segment of a reassembled PDU]"
"1514","80  >  52405 [ACK] Seq=399165 Ack=432 Win=64240 Len=1460 [TCP segment of a reassembled PDU]"
"1514","80  >  52405 [ACK] Seq=400625 Ack=432 Win=64240 Len=1460 [TCP segment of a reassembled PDU]"
"1442","80  >  52405 [PSH, ACK] Seq=402085 Ack=432 Win=64240 Len=1388 [TCP segment of a reassembled PDU]"
"54","52405  >  80 [ACK] Seq=432 Ack=403473 Win=64240 Len=0"
"1502","80  >  52405 [PSH, ACK] Seq=403473 Ack=432 Win=64240 Len=1448 [TCP segment of a reassembled PDU]"
"1502","80  >  52405 [PSH, ACK] Seq=404921 Ack=432 Win=64240 Len=1448 [TCP segment of a reassembled PDU]"
"54","52405  >  80 [ACK] Seq=432 Ack=406369 Win=64240 Len=0"
"1502","80  >  52405 [PSH, ACK] Seq=406369 Ack=432 Win=64240 Len=1448 [TCP segment of a reassembled PDU]"
"1502","80  >  52405 [PSH, ACK] Seq=407817 Ack=432 Win=64240 Len=1448 [TCP segment of a reassembled PDU]"
"54","52405  >  80 [ACK] Seq=432 Ack=409265 Win=64240 Len=0"
"1502","80  >  52405 [PSH, ACK] Seq=409265 Ack=432 Win=64240 Len=1448 [TCP segment of a reassembled PDU]"
"1502","80  >  52405 [PSH, ACK] Seq=410713 Ack=432 Win=64240 Len=1448 [TCP segment of a reassembled PDU]"
"54","52405  >  80 [ACK] Seq=432 Ack=412161 Win=64240 Len=0"
"1502","80  >  52405 [PSH, ACK] Seq=412161 Ack=432 Win=64240 Len=1448 [TCP segment of a reassembled PDU]"
"1502","80  >  52405 [PSH, ACK] Seq=413609 Ack=432 Win=64240 Len=1448 [TCP segment of a reassembled PDU]"
"54","52405  >  80 [ACK] Seq=432 Ack=415057 Win=64240 Len=0"
"1502","80  >  52405 [PSH, ACK] Seq=415057 Ack=432 Win=64240 Len=1448 [TCP segment of a reassembled PDU]"
"1502","80  >  52405 [PSH, ACK] Seq=416505 Ack=432 Win=64240 Len=1448 [TCP segment of a reassembled PDU]"
"54","52405  >  80 [ACK] Seq=432 Ack=417953 Win=64240 Len=0"
"1502","80  >  52405 [PSH, ACK] Seq=417953 Ack=432 Win=64240 Len=1448 [TCP segment of a reassembled PDU]"
"1502","80  >  52405 [PSH, ACK] Seq=419401 Ack=432 Win=64240 Len=1448 [TCP segment of a reassembled PDU]"
"54","52405  >  80 [ACK] Seq=432 Ack=420849 Win=64240 Len=0"
"1502","80  >  52405 [PSH, ACK] Seq=420849 Ack=432 Win=64240 Len=1448 [TCP segment of a reassembled PDU]"
"1502","80  >  52405 [PSH, ACK] Seq=422297 Ack=432 Win=64240 Len=1448 [TCP segment of a reassembled PDU]"
"54","52405  >  80 [ACK] Seq=432 Ack=423745 Win=64240 Len=0"
"1502","80  >  52405 [PSH, ACK] Seq=423745 Ack=432 Win=64240 Len=1448 [TCP segment of a reassembled PDU]"
"1502","80  >  52405 [PSH, ACK] Seq=425193 Ack=432 Win=64240 Len=1448 [TCP segment of a reassembled PDU]"
"1502","80  >  52405 [PSH, ACK] Seq=426641 Ack=432 Win=64240 Len=1448 [TCP segment of a reassembled PDU]"
"54","52405  >  80 [ACK] Seq=432 Ack=428089 Win=64240 Len=0"
"1502","80  >  52405 [PSH, ACK] Seq=428089 Ack=432 Win=64240 Len=1448 [TCP segment of a reassembled PDU]"
"1502","80  >  52405 [PSH, ACK] Seq=429537 Ack=432 Win=64240 Len=1448 [TCP segment of a reassembled PDU]"
"54","52405  >  80 [ACK] Seq=432 Ack=430985 Win=64240 Len=0"
"1502","80  >  52405 [PSH, ACK] Seq=430985 Ack=432 Win=64240 Len=1448 [TCP segment of a reassembled PDU]"
"1502","80  >  52405 [PSH, ACK] Seq=432433 Ack=432 Win=64240 Len=1448 [TCP segment of a reassembled PDU]"
"54","52405  >  80 [ACK] Seq=432 Ack=433881 Win=64240 Len=0"
"1514","80  >  52405 [ACK] Seq=433881 Ack=432 Win=64240 Len=1460 [TCP segment of a reassembled PDU]"
"1490","80  >  52405 [PSH, ACK] Seq=435341 Ack=432 Win=64240 Len=1436 [TCP segment of a reassembled PDU]"
"54","52405  >  80 [ACK] Seq=432 Ack=436777 Win=64240 Len=0"
"1502","80  >  52405 [PSH, ACK] Seq=436777 Ack=432 Win=64240 Len=1448 [TCP segment of a reassembled PDU]"
"1502","80  >  52405 [PSH, ACK] Seq=438225 Ack=432 Win=64240 Len=1448 [TCP segment of a reassembled PDU]"
"54","52405  >  80 [ACK] Seq=432 Ack=439673 Win=64240 Len=0"
"1502","80  >  52405 [PSH, ACK] Seq=439673 Ack=432 Win=64240 Len=1448 [TCP segment of a reassembled PDU]"
"1502","80  >  52405 [PSH, ACK] Seq=441121 Ack=432 Win=64240 Len=1448 [TCP segment of a reassembled PDU]"
"54","52405  >  80 [ACK] Seq=432 Ack=442569 Win=64240 Len=0"
"1502","80  >  52405 [PSH, ACK] Seq=442569 Ack=432 Win=64240 Len=1448 [TCP segment of a reassembled PDU]"
"1502","80  >  52405 [PSH, ACK] Seq=444017 Ack=432 Win=64240 Len=1448 [TCP segment of a reassembled PDU]"
"54","52405  >  80 [ACK] Seq=432 Ack=445465 Win=64240 Len=0"
"1502","80  >  52405 [PSH, ACK] Seq=445465 Ack=432 Win=64240 Len=1448 [TCP segment of a reassembled PDU]"
