"Length","Info"
"55","52166  >  443 [ACK] Seq=1 Ack=1 Win=62853 Len=1 [TCP segment of a reassembled PDU]"
"60","443  >  52166 [ACK] Seq=1 Ack=2 Win=64240 Len=0"
"55","Continuation"
"60","80  >  51667 [ACK] Seq=1 Ack=2 Win=64240 Len=0"
"73","Standard query 0xae84 A www.google.fr"
"89","Standard query response 0xae84 A www.google.fr A 216.58.208.227"
"66","52182  >  443 [SYN] Seq=0 Win=8192 Len=0 MSS=1460 WS=256 SACK_PERM=1"
"66","52183  >  443 [SYN] Seq=0 Win=8192 Len=0 MSS=1460 WS=256 SACK_PERM=1"
"60","443  >  52182 [SYN, ACK] Seq=0 Ack=1 Win=64240 Len=0 MSS=1460"
"54","52182  >  443 [ACK] Seq=1 Ack=1 Win=64240 Len=0"
"571","Client Hello"
"60","443  >  52182 [ACK] Seq=1 Ack=518 Win=64240 Len=0"
"42","Who has 172.16.21.128? Tell 172.16.254.128"
"60","443  >  52183 [SYN, ACK] Seq=0 Ack=1 Win=64240 Len=0 MSS=1460"
"54","52183  >  443 [ACK] Seq=1 Ack=1 Win=64240 Len=0"
"207","Server Hello, Change Cipher Spec, Encrypted Handshake Message"
"270","Change Cipher Spec, Encrypted Handshake Message, Encrypted Handshake Message"
"60","443  >  52182 [ACK] Seq=154 Ack=734 Win=64240 Len=0"
"571","Client Hello"
"60","443  >  52183 [ACK] Seq=1 Ack=518 Win=64240 Len=0"
"110","Application Data"
"96","Application Data"
"54","52182  >  443 [ACK] Seq=734 Ack=252 Win=63989 Len=0"
"207","Server Hello, Change Cipher Spec, Encrypted Handshake Message"
"270","Change Cipher Spec, Encrypted Handshake Message, Encrypted Handshake Message"
"60","443  >  52183 [ACK] Seq=154 Ack=734 Win=64240 Len=0"
"110","Application Data"
"96","Application Data"
"54","52183  >  443 [ACK] Seq=734 Ack=252 Win=63989 Len=0"
"107","Application Data"
"104","Application Data"
"60","443  >  52182 [ACK] Seq=252 Ack=787 Win=64240 Len=0"
"60","443  >  52182 [ACK] Seq=252 Ack=837 Win=64240 Len=0"
"96","Application Data"
"60","443  >  52182 [ACK] Seq=252 Ack=879 Win=64240 Len=0"
"92","Application Data"
"565","Application Data"
"60","443  >  52182 [ACK] Seq=252 Ack=917 Win=64240 Len=0"
"60","443  >  52182 [ACK] Seq=252 Ack=1428 Win=64240 Len=0"
"92","Application Data"
"229","Application Data"
"54","52182  >  443 [ACK] Seq=1428 Ack=465 Win=63776 Len=0"
"1514","Application Data"
"1394","Application Data"
"54","52182  >  443 [ACK] Seq=1428 Ack=3265 Win=64240 Len=0"
"1454","Application Data"
"1514","Application Data"
"1514","Application Data [TCP segment of a reassembled PDU]"
"1334","Application Data"
"1454","Application Data"
"1454","Application Data"
"54","52182  >  443 [ACK] Seq=1428 Ack=11665 Win=64240 Len=0"
"1472","Application Data"
"1436","Application Data"
"54","52182  >  443 [ACK] Seq=1428 Ack=14465 Win=64240 Len=0"
"1514","Application Data"
"144","Application Data, Application Data"
"54","52182  >  443 [ACK] Seq=1428 Ack=16015 Win=64240 Len=0"
"100","Application Data"
"60","443  >  52182 [ACK] Seq=16015 Ack=1474 Win=64240 Len=0"
"143","Application Data"
"60","443  >  52182 [ACK] Seq=16015 Ack=1563 Win=64240 Len=0"
"75","Standard query 0xfec2 A ssl.gstatic.com"
"91","Standard query response 0xfec2 A ssl.gstatic.com A 216.58.208.227"
"66","52184  >  443 [SYN] Seq=0 Win=8192 Len=0 MSS=1460 WS=256 SACK_PERM=1"
"60","443  >  52184 [SYN, ACK] Seq=0 Ack=1 Win=64240 Len=0 MSS=1460"
"54","52184  >  443 [ACK] Seq=1 Ack=1 Win=64240 Len=0"
"571","Client Hello"
"60","443  >  52184 [ACK] Seq=1 Ack=518 Win=64240 Len=0"
"203","Server Hello, Change Cipher Spec, Encrypted Handshake Message"
"105","Change Cipher Spec, Encrypted Handshake Message"
"60","443  >  52184 [ACK] Seq=150 Ack=569 Win=64240 Len=0"
"107","Application Data"
"60","443  >  52184 [ACK] Seq=150 Ack=622 Win=64240 Len=0"
"169","Application Data"
"104","Application Data"
"60","443  >  52184 [ACK] Seq=150 Ack=672 Win=64240 Len=0"
"96","Application Data"
"60","443  >  52184 [ACK] Seq=150 Ack=714 Win=64240 Len=0"
"400","Application Data"
"60","443  >  52184 [ACK] Seq=150 Ack=1060 Win=64240 Len=0"
"526","Application Data, Application Data"
"54","52182  >  443 [ACK] Seq=1563 Ack=16602 Win=63653 Len=0"
"100","Application Data"
"60","443  >  52182 [ACK] Seq=16602 Ack=1609 Win=64240 Len=0"
"129","Application Data"
"136","Application Data"
"60","443  >  52182 [ACK] Seq=16602 Ack=1684 Win=64240 Len=0"
"60","443  >  52182 [ACK] Seq=16602 Ack=1766 Win=64240 Len=0"
"152","Application Data, Application Data"
"92","Application Data"
"60","443  >  52184 [ACK] Seq=248 Ack=1098 Win=64240 Len=0"
"92","Application Data"
"305","Application Data"
"54","52184  >  443 [ACK] Seq=1098 Ack=537 Win=63704 Len=0"
"853","Application Data"
"100","Application Data"
"54","52184  >  443 [ACK] Seq=1098 Ack=1382 Win=62859 Len=0"
"100","Application Data"
"60","443  >  52184 [ACK] Seq=1382 Ack=1144 Win=64240 Len=0"
"140","Application Data"
"60","443  >  52182 [ACK] Seq=16602 Ack=1852 Win=64240 Len=0"
"245","Application Data"
"60","443  >  52182 [ACK] Seq=16602 Ack=2043 Win=64240 Len=0"
"42","Who has 172.16.21.128? Tell 172.16.254.128"
"267","Application Data"
"1514","Application Data"
"1514","Application Data [TCP segment of a reassembled PDU]"
"1514","Application Data [TCP segment of a reassembled PDU]"
"1514","Application Data [TCP segment of a reassembled PDU]"
"1514","Application Data [TCP segment of a reassembled PDU]"
"1154","Application Data"
"54","52182  >  443 [ACK] Seq=2043 Ack=25215 Win=64240 Len=0"
"1454","Application Data"
"1454","Application Data"
"54","52182  >  443 [ACK] Seq=2043 Ack=28015 Win=64240 Len=0"
"1454","Application Data"
"1454","Application Data"
"54","52182  >  443 [ACK] Seq=2043 Ack=30815 Win=64240 Len=0"
"1514","Application Data"
"1394","Application Data"
"54","52182  >  443 [ACK] Seq=2043 Ack=33615 Win=64240 Len=0"
"1454","Application Data"
"1454","Application Data"
"54","52182  >  443 [ACK] Seq=2043 Ack=36415 Win=64240 Len=0"
"1454","Application Data"
"1454","Application Data"
"54","52182  >  443 [ACK] Seq=2043 Ack=39215 Win=64240 Len=0"
"1454","Application Data"
"96","Application Data"
"60","443  >  52182 [ACK] Seq=40615 Ack=2085 Win=64240 Len=0"
"1454","Application Data"
"1454","Application Data"
"54","52182  >  443 [ACK] Seq=2085 Ack=43415 Win=64240 Len=0"
"1454","Application Data"
"1514","Application Data"
"1514","Application Data [TCP segment of a reassembled PDU]"
"1514","Application Data [TCP segment of a reassembled PDU]"
"1514","Application Data [TCP segment of a reassembled PDU]"
"1096","Application Data"
"54","52182  >  443 [ACK] Seq=2085 Ack=51697 Win=64240 Len=0"
"1514","Application Data"
"1514","Application Data [TCP segment of a reassembled PDU]"
"1514","Application Data [TCP segment of a reassembled PDU]"
"1514","Application Data [TCP segment of a reassembled PDU]"
"1514","Application Data [TCP segment of a reassembled PDU]"
"1208","Application Data [TCP segment of a reassembled PDU]"
"54","52182  >  443 [ACK] Seq=2085 Ack=60151 Win=64240 Len=0"
"1514","Application Data [TCP segment of a reassembled PDU]"
"1430","Application Data [TCP segment of a reassembled PDU]"
"1472","Application Data [TCP segment of a reassembled PDU]"
"54","52182  >  443 [ACK] Seq=2085 Ack=64405 Win=64240 Len=0"
"1472","Application Data [TCP segment of a reassembled PDU]"
"1472","Application Data [TCP segment of a reassembled PDU]"
"54","52182  >  443 [ACK] Seq=2085 Ack=67241 Win=64240 Len=0"
"1514","Application Data [TCP segment of a reassembled PDU]"
"1514","Application Data, Application Data, Application Data"
"1514","Application Data [TCP segment of a reassembled PDU]"
"1514","Application Data [TCP segment of a reassembled PDU]"
"1514","Application Data [TCP segment of a reassembled PDU]"
"1514","Application Data, Application Data, Application Data, Application Data"
"1514","Application Data [TCP segment of a reassembled PDU]"
"1514","Application Data [TCP segment of a reassembled PDU]"
"1514","Application Data [TCP segment of a reassembled PDU]"
"1514","Application Data [TCP segment of a reassembled PDU]"
"1514","Application Data [TCP segment of a reassembled PDU]"
"1514","Application Data [TCP segment of a reassembled PDU]"
"1514","Application Data [TCP segment of a reassembled PDU]"
"1514","Application Data [TCP segment of a reassembled PDU]"
"1514","Application Data [TCP segment of a reassembled PDU]"
"1514","Application Data, Application Data, Application Data, Application Data"
"1514","Application Data [TCP segment of a reassembled PDU]"
"1514","Application Data [TCP segment of a reassembled PDU]"
"1514","Application Data [TCP segment of a reassembled PDU]"
"1514","Application Data [TCP segment of a reassembled PDU]"
"1514","Application Data [TCP segment of a reassembled PDU]"
"1514","Application Data [TCP segment of a reassembled PDU]"
"1514","Application Data [TCP segment of a reassembled PDU]"
"1514","Application Data [TCP segment of a reassembled PDU]"
"1514","Application Data [TCP segment of a reassembled PDU]"
"1514","Application Data [TCP segment of a reassembled PDU]"
"437","Application Data, Application Data, Application Data"
"54","52182  >  443 [ACK] Seq=2085 Ack=105584 Win=34657 Len=0"
"54","[TCP Window Update] 52182  >  443 [ACK] Seq=2085 Ack=105584 Win=64240 Len=0"
"100","Application Data"
"100","Application Data"
"60","443  >  52182 [ACK] Seq=105584 Ack=2131 Win=64240 Len=0"
"60","443  >  52182 [ACK] Seq=105584 Ack=2177 Win=64240 Len=0"
"100","Application Data"
"100","Application Data"
"60","443  >  52182 [ACK] Seq=105584 Ack=2223 Win=64240 Len=0"
"60","443  >  52182 [ACK] Seq=105584 Ack=2269 Win=64240 Len=0"
"96","Application Data"
"60","443  >  52182 [ACK] Seq=105584 Ack=2311 Win=64240 Len=0"
"143","Application Data"
"60","443  >  52182 [ACK] Seq=105584 Ack=2400 Win=64240 Len=0"
"104","Application Data"
"512","Application Data, Application Data"
"54","52182  >  443 [ACK] Seq=2400 Ack=106092 Win=63732 Len=0"
"100","Application Data"
"60","443  >  52182 [ACK] Seq=106092 Ack=2446 Win=64240 Len=0"
"210","Application Data"
"60","443  >  52182 [ACK] Seq=106092 Ack=2602 Win=64240 Len=0"
"74","Standard query 0xc9f8 A www.reddit.com"
"314","Standard query response 0xc9f8 A www.reddit.com A 198.41.209.141 A 198.41.209.138 A 198.41.209.137 A 198.41.208.143 A 198.41.208.142 A 198.41.209.136 A 198.41.208.137 A 198.41.208.140 A 198.41.209.143 A 198.41.209.142 A 198.41.209.139 A 198.41.208.139 A 198.41.208.141 A 198.41.208.138 A 198.41.209.140"
"66","52185  >  80 [SYN] Seq=0 Win=8192 Len=0 MSS=1460 WS=256 SACK_PERM=1"
"66","52186  >  80 [SYN] Seq=0 Win=8192 Len=0 MSS=1460 WS=256 SACK_PERM=1"
"623","Application Data, Application Data, Application Data"
"100","Application Data"
"60","443  >  52182 [ACK] Seq=106661 Ack=2648 Win=64240 Len=0"
"193","Application Data"
"60","443  >  52182 [ACK] Seq=106661 Ack=2787 Win=64240 Len=0"
"186","Application Data"
"60","443  >  52182 [ACK] Seq=106661 Ack=2919 Win=64240 Len=0"
"60","80  >  52185 [SYN, ACK] Seq=0 Ack=1 Win=64240 Len=0 MSS=1460"
"60","80  >  52186 [SYN, ACK] Seq=0 Ack=1 Win=64240 Len=0 MSS=1460"
"54","52185  >  80 [ACK] Seq=1 Ack=1 Win=64240 Len=0"
"54","52186  >  80 [ACK] Seq=1 Ack=1 Win=64240 Len=0"
"163","Application Data"
"1454","Application Data"
"54","52182  >  443 [ACK] Seq=2919 Ack=108170 Win=64240 Len=0"
"1454","Application Data"
"1514","Application Data"
"1514","Application Data [TCP segment of a reassembled PDU]"
"1334","Application Data"
"1454","Application Data"
"54","52182  >  443 [ACK] Seq=2919 Ack=115170 Win=64240 Len=0"
"1454","Application Data"
"1514","Application Data"
"1394","Application Data"
"1258","Application Data"
"54","52182  >  443 [ACK] Seq=2919 Ack=120574 Win=58836 Len=0"
"255","Application Data, Application Data, Application Data, Application Data"
"211","Application Data"
"60","443  >  52182 [ACK] Seq=120775 Ack=3076 Win=64240 Len=0"
"54","[TCP Window Update] 52182  >  443 [ACK] Seq=3076 Ack=120775 Win=64240 Len=0"
"100","Application Data"
"60","443  >  52182 [ACK] Seq=120775 Ack=3122 Win=64240 Len=0"
"100","Application Data"
"60","443  >  52182 [ACK] Seq=120775 Ack=3168 Win=64240 Len=0"
"96","Application Data"
"60","443  >  52182 [ACK] Seq=120775 Ack=3210 Win=64240 Len=0"
"109","Application Data"
"661","Application Data, Application Data"
"54","52182  >  443 [ACK] Seq=3210 Ack=121437 Win=63578 Len=0"
"100","Application Data"
"60","443  >  52182 [ACK] Seq=121437 Ack=3256 Win=64240 Len=0"
"212","Application Data"
"60","443  >  52182 [ACK] Seq=121437 Ack=3414 Win=64240 Len=0"
"586","Application Data, Application Data, Application Data"
"100","Application Data"
"60","443  >  52182 [ACK] Seq=121969 Ack=3460 Win=64240 Len=0"
"212","Application Data"
"60","443  >  52182 [ACK] Seq=121969 Ack=3618 Win=64240 Len=0"
"576","Application Data, Application Data, Application Data"
"100","Application Data"
"60","443  >  52182 [ACK] Seq=122491 Ack=3664 Win=64240 Len=0"
"504","Application Data"
"60","443  >  52182 [ACK] Seq=122491 Ack=4114 Win=64240 Len=0"
"42","Who has 172.16.21.128? Tell 172.16.254.128"
"123","Application Data"
"100","Application Data"
"60","443  >  52182 [ACK] Seq=122537 Ack=4183 Win=64240 Len=0"
"138","Application Data, Application Data"
"54","52182  >  443 [ACK] Seq=4183 Ack=122621 Win=64110 Len=0"
"100","Application Data"
"60","443  >  52182 [ACK] Seq=122621 Ack=4229 Win=64240 Len=0"
"211","Application Data"
"1120","Application Data, Application Data"
"54","52182  >  443 [ACK] Seq=4229 Ack=123844 Win=62887 Len=0"
"100","Application Data"
"60","443  >  52182 [ACK] Seq=123844 Ack=4275 Win=64240 Len=0"
"170","Application Data"
"60","443  >  52182 [ACK] Seq=123844 Ack=4391 Win=64240 Len=0"
"132","Application Data"
"1514","Application Data"
"1514","Application Data [TCP segment of a reassembled PDU]"
"1334","Application Data"
"54","52182  >  443 [ACK] Seq=4391 Ack=128122 Win=64240 Len=0"
"1454","Application Data"
"1514","Application Data"
"1394","Application Data"
"54","52182  >  443 [ACK] Seq=4391 Ack=132322 Win=64240 Len=0"
"1454","Application Data"
"1454","Application Data"
"54","52182  >  443 [ACK] Seq=4391 Ack=135122 Win=64240 Len=0"
"1514","Application Data"
"1514","Application Data [TCP segment of a reassembled PDU]"
"1514","Application Data [TCP segment of a reassembled PDU]"
"992","Application Data"
"54","52182  >  443 [ACK] Seq=4391 Ack=140440 Win=64240 Len=0"
"1454","Application Data"
"1454","Application Data"
"54","52182  >  443 [ACK] Seq=4391 Ack=143240 Win=64240 Len=0"
"1454","Application Data"
"1454","Application Data"
"54","52182  >  443 [ACK] Seq=4391 Ack=146040 Win=64240 Len=0"
"1454","Application Data"
"1514","Application Data"
"1514","Application Data [TCP segment of a reassembled PDU]"
"1514","Application Data [TCP segment of a reassembled PDU]"
"1514","Application Data [TCP segment of a reassembled PDU]"
"1514","Application Data [TCP segment of a reassembled PDU]"
"1514","Application Data, Application Data"
"1514","Application Data [TCP segment of a reassembled PDU]"
"89","Application Data"
"100","Application Data"
"54","52182  >  443 [ACK] Seq=4391 Ack=157741 Win=62699 Len=0"
"54","[TCP Window Update] 52182  >  443 [ACK] Seq=4391 Ack=157741 Win=64240 Len=0"
"96","Application Data"
"100","Application Data"
"60","443  >  52182 [ACK] Seq=157741 Ack=4433 Win=64240 Len=0"
"60","443  >  52182 [ACK] Seq=157741 Ack=4479 Win=64240 Len=0"
"66","52187  >  443 [SYN] Seq=0 Win=8192 Len=0 MSS=1460 WS=256 SACK_PERM=1"
"447","Application Data"
"60","443  >  52182 [ACK] Seq=157741 Ack=4872 Win=64240 Len=0"
"60","443  >  52187 [SYN, ACK] Seq=0 Ack=1 Win=64240 Len=0 MSS=1460"
"54","52187  >  443 [ACK] Seq=1 Ack=1 Win=64240 Len=0"
"571","Client Hello"
"60","443  >  52187 [ACK] Seq=1 Ack=518 Win=64240 Len=0"
"207","Server Hello, Change Cipher Spec, Encrypted Handshake Message"
"270","Change Cipher Spec, Encrypted Handshake Message, Encrypted Handshake Message"
"60","443  >  52187 [ACK] Seq=154 Ack=734 Win=64240 Len=0"
"107","Application Data"
"60","443  >  52187 [ACK] Seq=154 Ack=787 Win=64240 Len=0"
"104","Application Data"
"96","Application Data"
"379","Application Data"
"60","443  >  52187 [ACK] Seq=154 Ack=837 Win=64240 Len=0"
"60","443  >  52187 [ACK] Seq=154 Ack=879 Win=64240 Len=0"
"60","443  >  52187 [ACK] Seq=154 Ack=1204 Win=64240 Len=0"
"123","Application Data"
"138","Application Data, Application Data"
"54","52182  >  443 [ACK] Seq=4872 Ack=157894 Win=64087 Len=0"
"110","Application Data"
"100","Application Data"
"96","Application Data"
"54","52187  >  443 [ACK] Seq=1204 Ack=252 Win=63989 Len=0"
"60","443  >  52182 [ACK] Seq=157894 Ack=4918 Win=64240 Len=0"
"92","Application Data"
"60","443  >  52187 [ACK] Seq=252 Ack=1242 Win=64240 Len=0"
"1514","Application Data, Application Data"
"1514","Application Data [TCP segment of a reassembled PDU]"
"1514","Application Data [TCP segment of a reassembled PDU]"
"1514","Application Data [TCP segment of a reassembled PDU]"
"1503","Application Data, Application Data"
"54","52187  >  443 [ACK] Seq=1242 Ack=7541 Win=64240 Len=0"
"1436","Application Data"
"1454","Application Data"
"54","52187  >  443 [ACK] Seq=1242 Ack=10323 Win=64240 Len=0"
"1454","Application Data"
"1514","Application Data"
"1514","Application Data [TCP segment of a reassembled PDU]"
"1352","Application Data [TCP segment of a reassembled PDU]"
"54","52187  >  443 [ACK] Seq=1242 Ack=15941 Win=64240 Len=0"
"1436","Application Data"
"1514","Application Data"
"1430","Application Data [TCP segment of a reassembled PDU]"
"54","52187  >  443 [ACK] Seq=1242 Ack=20159 Win=64240 Len=0"
"1418","Application Data"
"1514","Application Data"
"1514","Application Data [TCP segment of a reassembled PDU]"
"1514","Application Data [TCP segment of a reassembled PDU]"
"1274","Application Data"
"54","52187  >  443 [ACK] Seq=1242 Ack=27123 Win=64240 Len=0"
"1454","Application Data"
"1454","Application Data"
"54","52187  >  443 [ACK] Seq=1242 Ack=29923 Win=64240 Len=0"
"1454","Application Data"
"1454","Application Data"
"1336","Application Data"
"54","52187  >  443 [ACK] Seq=1242 Ack=34005 Win=64240 Len=0"
"1454","Application Data"
"1514","Application Data"
"1394","Application Data"
"54","52187  >  443 [ACK] Seq=1242 Ack=38205 Win=64240 Len=0"
"1472","Application Data"
"1472","Application Data [TCP segment of a reassembled PDU]"
"1472","Application Data [TCP segment of a reassembled PDU]"
"54","52187  >  443 [ACK] Seq=1242 Ack=42459 Win=64240 Len=0"
"96","Application Data"
"60","443  >  52187 [ACK] Seq=42459 Ack=1284 Win=64240 Len=0"
"1472","Application Data [TCP segment of a reassembled PDU]"
"1472","Application Data [TCP segment of a reassembled PDU]"
"54","52187  >  443 [ACK] Seq=1284 Ack=45295 Win=64240 Len=0"
"1514","Application Data [TCP segment of a reassembled PDU]"
"1514","Application Data [TCP segment of a reassembled PDU]"
"1514","Application Data [TCP segment of a reassembled PDU]"
"1514","Application Data [TCP segment of a reassembled PDU]"
"1514","Application Data [TCP segment of a reassembled PDU]"
"1514","Application Data [TCP segment of a reassembled PDU]"
"1514","Application Data [TCP segment of a reassembled PDU]"
"1178","Application Data [TCP segment of a reassembled PDU]"
"1472","Application Data [TCP segment of a reassembled PDU]"
"1472","Application Data [TCP segment of a reassembled PDU]"
"1472","Application Data [TCP segment of a reassembled PDU]"
"1472","Application Data [TCP segment of a reassembled PDU]"
"1472","Application Data [TCP segment of a reassembled PDU]"
"1472","Application Data [TCP segment of a reassembled PDU]"
"54","52187  >  443 [ACK] Seq=1284 Ack=65147 Win=51688 Len=0"
"54","[TCP Window Update] 52187  >  443 [ACK] Seq=1284 Ack=65147 Win=64240 Len=0"
"1472","Application Data [TCP segment of a reassembled PDU]"
"1472","Application Data [TCP segment of a reassembled PDU]"
"1472","Application Data [TCP segment of a reassembled PDU]"
"54","52187  >  443 [ACK] Seq=1284 Ack=69401 Win=64240 Len=0"
"1472","Application Data [TCP segment of a reassembled PDU]"
"1472","Application Data [TCP segment of a reassembled PDU]"
"54","52187  >  443 [ACK] Seq=1284 Ack=72237 Win=64240 Len=0"
"1472","Application Data [TCP segment of a reassembled PDU]"
"1472","Application Data [TCP segment of a reassembled PDU]"
"1472","Application Data [TCP segment of a reassembled PDU]"
"54","52187  >  443 [ACK] Seq=1284 Ack=76491 Win=64240 Len=0"
"96","Application Data"
"1514","Application Data [TCP segment of a reassembled PDU]"
"1514","Application Data [TCP segment of a reassembled PDU]"
"1514","Application Data [TCP segment of a reassembled PDU]"
"1514","Application Data [TCP segment of a reassembled PDU]"
"1304","Application Data [TCP segment of a reassembled PDU]"
"54","52187  >  443 [ACK] Seq=1326 Ack=83581 Win=64240 Len=0"
"1472","Application Data [TCP segment of a reassembled PDU]"
"1472","Application Data [TCP segment of a reassembled PDU]"
"54","52187  >  443 [ACK] Seq=1326 Ack=86417 Win=64240 Len=0"
"1472","Application Data [TCP segment of a reassembled PDU]"
"1472","Application Data [TCP segment of a reassembled PDU]"
"54","52187  >  443 [ACK] Seq=1326 Ack=89253 Win=64240 Len=0"
"1472","Application Data [TCP segment of a reassembled PDU]"
"1514","Application Data [TCP segment of a reassembled PDU]"
"1514","Application Data [TCP segment of a reassembled PDU]"
"1514","Application Data [TCP segment of a reassembled PDU]"
"1514","Application Data [TCP segment of a reassembled PDU]"
"1514","Application Data [TCP segment of a reassembled PDU]"
"1514","Application Data [TCP segment of a reassembled PDU]"
"1514","Application Data [TCP segment of a reassembled PDU]"
"1514","Application Data [TCP segment of a reassembled PDU]"
"1514","Application Data, Application Data"
"1514","Application Data [TCP segment of a reassembled PDU]"
"1514","Application Data [TCP segment of a reassembled PDU]"
"1514","Application Data [TCP segment of a reassembled PDU]"
"968","443  >  52187 [PSH, ACK] Seq=108191 Ack=1326 Win=64240 Len=914 [TCP segment of a reassembled PDU]"
"54","52187  >  443 [ACK] Seq=1326 Ack=109105 Win=54566 Len=0"
"54","[TCP Window Update] 52187  >  443 [ACK] Seq=1326 Ack=109105 Win=64240 Len=0"
"1472","Application Data [TCP segment of a reassembled PDU]"
"1514","Application Data [TCP segment of a reassembled PDU]"
"1430","Application Data [TCP segment of a reassembled PDU]"
"1472","Application Data [TCP segment of a reassembled PDU]"
"54","52187  >  443 [ACK] Seq=1326 Ack=114777 Win=58568 Len=0"
"1472","Application Data [TCP segment of a reassembled PDU]"
"1472","Application Data [TCP segment of a reassembled PDU]"
"54","52187  >  443 [ACK] Seq=1326 Ack=117613 Win=55732 Len=0"
"54","[TCP Window Update] 52187  >  443 [ACK] Seq=1326 Ack=117613 Win=64240 Len=0"
"1472","Application Data [TCP segment of a reassembled PDU]"
"1514","Application Data [TCP segment of a reassembled PDU]"
"1514","Application Data [TCP segment of a reassembled PDU]"
"1514","Application Data, Application Data"
"1514","Application Data [TCP segment of a reassembled PDU]"
"1359","Application Data, Application Data"
"54","52187  >  443 [ACK] Seq=1326 Ack=126176 Win=64240 Len=0"
"96","Application Data"
"100","Application Data"
"60","443  >  52187 [ACK] Seq=126176 Ack=1368 Win=64240 Len=0"
"60","443  >  52187 [ACK] Seq=126176 Ack=1414 Win=64240 Len=0"
"75","Standard query 0x7ff9 A www.gstatic.com"
"91","Standard query response 0x7ff9 A www.gstatic.com A 216.58.208.227"
"322","Application Data"
"60","443  >  52187 [ACK] Seq=126176 Ack=1682 Win=64240 Len=0"
"1514","Application Data"
"165","Application Data"
"1454","Application Data"
"54","52187  >  443 [ACK] Seq=1682 Ack=129147 Win=64240 Len=0"
"1454","Application Data"
"1514","Application Data"
"1514","Application Data [TCP segment of a reassembled PDU]"
"1514","Application Data [TCP segment of a reassembled PDU]"
"1514","Application Data [TCP segment of a reassembled PDU]"
"1514","Application Data [TCP segment of a reassembled PDU]"
"1154","Application Data"
"1514","Application Data"
"1394","Application Data"
"1454","Application Data"
"1514","Application Data"
"1412","Application Data [TCP segment of a reassembled PDU]"
"1436","Application Data"
"1514","Application Data"
"1394","Application Data"
"1454","Application Data"
"54","52187  >  443 [ACK] Seq=1682 Ack=151547 Win=51640 Len=0"
"1454","Application Data"
"54","52187  >  443 [ACK] Seq=1682 Ack=152947 Win=64240 Len=0"
"1514","Application Data"
"1514","Application Data [TCP segment of a reassembled PDU]"
"1514","Application Data [TCP segment of a reassembled PDU]"
"1274","Application Data"
"1514","Application Data"
"1514","Application Data [TCP segment of a reassembled PDU]"
"1216","Application Data"
"1454","Application Data"
"54","52187  >  443 [ACK] Seq=1682 Ack=164029 Win=53158 Len=0"
"54","[TCP Window Update] 52187  >  443 [ACK] Seq=1682 Ack=164029 Win=64240 Len=0"
"1454","Application Data"
"1514","Application Data"
"1394","Application Data"
"54","52187  >  443 [ACK] Seq=1682 Ack=168229 Win=64240 Len=0"
"1454","Application Data"
"96","Application Data"
"60","443  >  52187 [ACK] Seq=169629 Ack=1724 Win=64240 Len=0"
"1514","Application Data"
"1514","Application Data [TCP segment of a reassembled PDU]"
"1334","Application Data"
"54","52187  >  443 [ACK] Seq=1724 Ack=173829 Win=64240 Len=0"
"1514","Application Data"
"1412","Application Data [TCP segment of a reassembled PDU]"
"1436","Application Data"
"54","52187  >  443 [ACK] Seq=1724 Ack=178029 Win=64240 Len=0"
"96","Application Data"
"1454","Application Data"
"60","443  >  52187 [ACK] Seq=179429 Ack=1766 Win=64240 Len=0"
"1514","Application Data"
"1394","Application Data"
"54","52187  >  443 [ACK] Seq=1766 Ack=182229 Win=64240 Len=0"
"1514","Application Data"
"1327","Application Data, Application Data"
"54","52187  >  443 [ACK] Seq=1766 Ack=184962 Win=64240 Len=0"
"100","Application Data"
"60","443  >  52187 [ACK] Seq=184962 Ack=1812 Win=64240 Len=0"
"75","Standard query 0x391b A apis.google.com"
"112","Standard query response 0x391b A apis.google.com CNAME plus.l.google.com A 216.58.208.238"
"66","52188  >  443 [SYN] Seq=0 Win=8192 Len=0 MSS=1460 WS=256 SACK_PERM=1"
"60","443  >  52188 [SYN, ACK] Seq=0 Ack=1 Win=64240 Len=0 MSS=1460"
"54","52188  >  443 [ACK] Seq=1 Ack=1 Win=64240 Len=0"
"571","Client Hello"
"60","443  >  52188 [ACK] Seq=1 Ack=518 Win=64240 Len=0"
"207","Server Hello, Change Cipher Spec, Encrypted Handshake Message"
"270","Change Cipher Spec, Encrypted Handshake Message, Encrypted Handshake Message"
"60","443  >  52188 [ACK] Seq=154 Ack=734 Win=64240 Len=0"
"107","Application Data"
"104","Application Data"
"60","443  >  52188 [ACK] Seq=154 Ack=787 Win=64240 Len=0"
"96","Application Data"
"60","443  >  52188 [ACK] Seq=154 Ack=837 Win=64240 Len=0"
"60","443  >  52188 [ACK] Seq=154 Ack=879 Win=64240 Len=0"
"643","Application Data"
"60","443  >  52188 [ACK] Seq=154 Ack=1468 Win=64240 Len=0"
"152","Application Data, Application Data"
"92","Application Data"
"60","443  >  52188 [ACK] Seq=252 Ack=1506 Win=64240 Len=0"
"1514","Application Data, Application Data"
"299","Application Data"
"54","52188  >  443 [ACK] Seq=1506 Ack=1957 Win=64240 Len=0"
"1454","Application Data"
"1454","Application Data"
"54","52188  >  443 [ACK] Seq=1506 Ack=4757 Win=64240 Len=0"
"1454","Application Data"
"1454","Application Data"
"54","52188  >  443 [ACK] Seq=1506 Ack=7557 Win=64240 Len=0"
"1454","Application Data"
"1454","Application Data"
"54","52188  >  443 [ACK] Seq=1506 Ack=10357 Win=64240 Len=0"
"1454","Application Data"
"1514","Application Data"
"1514","Application Data [TCP segment of a reassembled PDU]"
"1514","Application Data [TCP segment of a reassembled PDU]"
"1274","Application Data"
"1454","Application Data"
"54","52188  >  443 [ACK] Seq=1506 Ack=18757 Win=64240 Len=0"
"1454","Application Data"
"1454","Application Data"
"54","52188  >  443 [ACK] Seq=1506 Ack=21557 Win=64240 Len=0"
"1454","Application Data"
"1472","Application Data"
"54","52188  >  443 [ACK] Seq=1506 Ack=24375 Win=64240 Len=0"
"1436","Application Data"
"1472","Application Data"
"54","52188  >  443 [ACK] Seq=1506 Ack=27175 Win=64240 Len=0"
"1472","Application Data [TCP segment of a reassembled PDU]"
"1514","Application Data [TCP segment of a reassembled PDU]"
"1514","Application Data [TCP segment of a reassembled PDU]"
"1514","Application Data [TCP segment of a reassembled PDU]"
"1514","Application Data [TCP segment of a reassembled PDU]"
"1514","Application Data [TCP segment of a reassembled PDU]"
"1000","Application Data"
"1454","Application Data"
"54","52188  >  443 [ACK] Seq=1506 Ack=38239 Win=62840 Len=0"
"1514","Application Data"
"1514","Application Data [TCP segment of a reassembled PDU]"
"1514","Application Data [TCP segment of a reassembled PDU]"
"1514","Application Data [TCP segment of a reassembled PDU]"
"1514","Application Data [TCP segment of a reassembled PDU]"
"1514","Application Data [TCP segment of a reassembled PDU]"
"1220","Application Data [TCP segment of a reassembled PDU]"
"1472","Application Data [TCP segment of a reassembled PDU]"
"54","52188  >  443 [ACK] Seq=1506 Ack=49583 Win=61656 Len=0"
"54","[TCP Window Update] 52188  >  443 [ACK] Seq=1506 Ack=49583 Win=64240 Len=0"
"1472","Application Data [TCP segment of a reassembled PDU]"
"96","Application Data"
"60","443  >  52188 [ACK] Seq=51001 Ack=1548 Win=64240 Len=0"
"456","Application Data, Application Data"
"100","Application Data"
"60","443  >  52188 [ACK] Seq=51403 Ack=1594 Win=64240 Len=0"
"478","GET / HTTP/1.1 "
"60","80  >  52185 [ACK] Seq=1 Ack=425 Win=64240 Len=0"
"1514","80  >  52185 [PSH, ACK] Seq=1 Ack=425 Win=64240 Len=1460 [TCP segment of a reassembled PDU]"
"1514","80  >  52185 [ACK] Seq=1461 Ack=425 Win=64240 Len=1460 [TCP segment of a reassembled PDU]"
"1514","80  >  52185 [ACK] Seq=2921 Ack=425 Win=64240 Len=1460 [TCP segment of a reassembled PDU]"
"1514","80  >  52185 [ACK] Seq=4381 Ack=425 Win=64240 Len=1460 [TCP segment of a reassembled PDU]"
"1514","80  >  52185 [ACK] Seq=5841 Ack=425 Win=64240 Len=1460 [TCP segment of a reassembled PDU]"
"1514","80  >  52185 [ACK] Seq=7301 Ack=425 Win=64240 Len=1460 [TCP segment of a reassembled PDU]"
"1514","80  >  52185 [PSH, ACK] Seq=8761 Ack=425 Win=64240 Len=1460 [TCP segment of a reassembled PDU]"
"54","52185  >  80 [ACK] Seq=425 Ack=10221 Win=64240 Len=0"
"1514","80  >  52185 [PSH, ACK] Seq=10221 Ack=425 Win=64240 Len=1460 [TCP segment of a reassembled PDU]"
"54","52185  >  80 [ACK] Seq=425 Ack=11681 Win=64240 Len=0"
"1514","80  >  52185 [ACK] Seq=11681 Ack=425 Win=64240 Len=1460 [TCP segment of a reassembled PDU]"
"1514","80  >  52185 [PSH, ACK] Seq=13141 Ack=425 Win=64240 Len=1460 [TCP segment of a reassembled PDU]"
"54","52185  >  80 [ACK] Seq=425 Ack=14601 Win=64240 Len=0"
"1514","80  >  52185 [ACK] Seq=14601 Ack=425 Win=64240 Len=1460 [TCP segment of a reassembled PDU]"
"1514","80  >  52185 [ACK] Seq=16061 Ack=425 Win=64240 Len=1460 [TCP segment of a reassembled PDU]"
"1514","80  >  52185 [PSH, ACK] Seq=17521 Ack=425 Win=64240 Len=1460 [TCP segment of a reassembled PDU]"
"54","52185  >  80 [ACK] Seq=425 Ack=18981 Win=64240 Len=0"
"1514","80  >  52185 [PSH, ACK] Seq=18981 Ack=425 Win=64240 Len=1460 [TCP segment of a reassembled PDU]"
"251","HTTP/1.1 200 OK  (text/html)"
"54","52185  >  80 [ACK] Seq=425 Ack=20638 Win=64240 Len=0"
"483","GET /reddit.IXjIj0Z6Dgc.css HTTP/1.1 "
"60","80  >  52145 [ACK] Seq=1 Ack=430 Win=64240 Len=0"
"512","GET /ba_fm376ctS_mGlZGabqddmkhth3jqnccUyhKW7iGBo.css HTTP/1.1 "
"60","80  >  52153 [ACK] Seq=1 Ack=459 Win=64240 Len=0"
"475","GET /reddit-init.fr.c7gGq8YZfSo.js HTTP/1.1 "
"514","GET /WnWL9EIaP8UCXn12wtaLaNrDSQgM4Dfrtammyb88RMU.png HTTP/1.1 "
"60","80  >  52157 [ACK] Seq=1 Ack=422 Win=64240 Len=0"
"470","GET /reddit.fr.vf-uApcZRS4.js HTTP/1.1 "
"60","80  >  52147 [ACK] Seq=1 Ack=461 Win=64240 Len=0"
"60","80  >  52146 [ACK] Seq=1 Ack=417 Win=64240 Len=0"
"929","HTTP/1.1 200 OK  (text/css)"
"1514","80  >  52145 [ACK] Seq=1 Ack=430 Win=64240 Len=1460 [TCP segment of a reassembled PDU]"
"1514","80  >  52145 [PSH, ACK] Seq=1461 Ack=430 Win=64240 Len=1460 [TCP segment of a reassembled PDU]"
"54","52145  >  80 [ACK] Seq=430 Ack=2921 Win=64240 Len=0"
"1514","80  >  52145 [PSH, ACK] Seq=2921 Ack=430 Win=64240 Len=1460 [TCP segment of a reassembled PDU]"
"1514","80  >  52145 [ACK] Seq=4381 Ack=430 Win=64240 Len=1460 [TCP segment of a reassembled PDU]"
"1514","80  >  52145 [ACK] Seq=5841 Ack=430 Win=64240 Len=1460 [TCP segment of a reassembled PDU]"
"1514","80  >  52145 [PSH, ACK] Seq=7301 Ack=430 Win=64240 Len=1460 [TCP segment of a reassembled PDU]"
"1514","80  >  52145 [PSH, ACK] Seq=8761 Ack=430 Win=64240 Len=1460 [TCP segment of a reassembled PDU]"
"54","52145  >  80 [ACK] Seq=430 Ack=10221 Win=64240 Len=0"
"1514","80  >  52145 [ACK] Seq=10221 Ack=430 Win=64240 Len=1460 [TCP segment of a reassembled PDU]"
"1514","80  >  52145 [PSH, ACK] Seq=11681 Ack=430 Win=64240 Len=1460 [TCP segment of a reassembled PDU]"
"54","52145  >  80 [ACK] Seq=430 Ack=13141 Win=64240 Len=0"
"1514","80  >  52147 [PSH, ACK] Seq=1 Ack=461 Win=64240 Len=1460 [TCP segment of a reassembled PDU]"
"1514","80  >  52147 [ACK] Seq=1461 Ack=461 Win=64240 Len=1460 [TCP segment of a reassembled PDU]"
"195","HTTP/1.1 200 OK  (PNG)"
"54","52147  >  80 [ACK] Seq=461 Ack=3062 Win=64240 Len=0"
"514","GET /9FkUjylHkmm-P0jauxAc2Qvl56nz1CfXK023PGWB5mA.jpg HTTP/1.1 "
"60","80  >  52147 [ACK] Seq=3062 Ack=921 Win=64240 Len=0"
"1514","80  >  52146 [PSH, ACK] Seq=1 Ack=417 Win=64240 Len=1460 [TCP segment of a reassembled PDU]"
"1514","80  >  52146 [PSH, ACK] Seq=1461 Ack=417 Win=64240 Len=1460 [TCP segment of a reassembled PDU]"
"54","52146  >  80 [ACK] Seq=417 Ack=2921 Win=64240 Len=0"
"1514","80  >  52146 [PSH, ACK] Seq=2921 Ack=417 Win=64240 Len=1460 [TCP segment of a reassembled PDU]"
"1514","80  >  52145 [ACK] Seq=13141 Ack=430 Win=64240 Len=1460 [TCP segment of a reassembled PDU]"
"1514","80  >  52145 [ACK] Seq=14601 Ack=430 Win=64240 Len=1460 [TCP segment of a reassembled PDU]"
"1514","80  >  52145 [ACK] Seq=16061 Ack=430 Win=64240 Len=1460 [TCP segment of a reassembled PDU]"
"1514","80  >  52145 [ACK] Seq=17521 Ack=430 Win=64240 Len=1460 [TCP segment of a reassembled PDU]"
"1514","80  >  52145 [ACK] Seq=18981 Ack=430 Win=64240 Len=1460 [TCP segment of a reassembled PDU]"
"1514","80  >  52145 [ACK] Seq=20441 Ack=430 Win=64240 Len=1460 [TCP segment of a reassembled PDU]"
"1514","80  >  52145 [ACK] Seq=21901 Ack=430 Win=64240 Len=1460 [TCP segment of a reassembled PDU]"
"1514","80  >  52145 [ACK] Seq=23361 Ack=430 Win=64240 Len=1460 [TCP segment of a reassembled PDU]"
"1514","80  >  52145 [ACK] Seq=24821 Ack=430 Win=64240 Len=1460 [TCP segment of a reassembled PDU]"
"1514","80  >  52145 [ACK] Seq=26281 Ack=430 Win=64240 Len=1460 [TCP segment of a reassembled PDU]"
"1514","80  >  52145 [ACK] Seq=27741 Ack=430 Win=64240 Len=1460 [TCP segment of a reassembled PDU]"
"1514","80  >  52145 [ACK] Seq=29201 Ack=430 Win=64240 Len=1460 [TCP segment of a reassembled PDU]"
"1514","80  >  52145 [ACK] Seq=30661 Ack=430 Win=64240 Len=1460 [TCP segment of a reassembled PDU]"
"1514","80  >  52145 [ACK] Seq=32121 Ack=430 Win=64240 Len=1460 [TCP segment of a reassembled PDU]"
"1514","80  >  52145 [ACK] Seq=33581 Ack=430 Win=64240 Len=1460 [TCP segment of a reassembled PDU]"
"939","80  >  52145 [PSH, ACK] Seq=35041 Ack=430 Win=64240 Len=885 [TCP segment of a reassembled PDU]"
"1514","80  >  52145 [PSH, ACK] Seq=35926 Ack=430 Win=64240 Len=1460 [TCP segment of a reassembled PDU]"
"54","52145  >  80 [ACK] Seq=430 Ack=37386 Win=48755 Len=0"
"54","[TCP Window Update] 52145  >  80 [ACK] Seq=430 Ack=37386 Win=64240 Len=0"
"1514","80  >  52147 [PSH, ACK] Seq=3062 Ack=921 Win=64240 Len=1460 [TCP segment of a reassembled PDU]"
"1514","80  >  52147 [PSH, ACK] Seq=4522 Ack=921 Win=64240 Len=1460 [TCP segment of a reassembled PDU]"
"54","52147  >  80 [ACK] Seq=921 Ack=5982 Win=64240 Len=0"
"1514","80  >  52147 [PSH, ACK] Seq=5982 Ack=921 Win=64240 Len=1460 [TCP segment of a reassembled PDU]"
"929","[TCP Retransmission] 80  >  52153 [PSH, ACK] Seq=1 Ack=459 Win=64240 Len=875"
"1514","80  >  52146 [ACK] Seq=4381 Ack=417 Win=64240 Len=1460 [TCP segment of a reassembled PDU]"
"1514","80  >  52146 [ACK] Seq=5841 Ack=417 Win=64240 Len=1460 [TCP segment of a reassembled PDU]"
"1514","80  >  52146 [PSH, ACK] Seq=7301 Ack=417 Win=64240 Len=1460 [TCP segment of a reassembled PDU]"
"1514","80  >  52147 [ACK] Seq=7442 Ack=921 Win=64240 Len=1460 [TCP segment of a reassembled PDU]"
"1388","HTTP/1.1 200 OK  (JPEG JFIF image)"
"1514","80  >  52146 [PSH, ACK] Seq=8761 Ack=417 Win=64240 Len=1460 [TCP segment of a reassembled PDU]"
"54","52153  >  80 [ACK] Seq=459 Ack=876 Win=63365 Len=0"
"54","52146  >  80 [ACK] Seq=417 Ack=10221 Win=64240 Len=0"
"54","52147  >  80 [ACK] Seq=921 Ack=10236 Win=64240 Len=0"
"1514","80  >  52146 [PSH, ACK] Seq=10221 Ack=417 Win=64240 Len=1460 [TCP segment of a reassembled PDU]"
"1514","80  >  52146 [PSH, ACK] Seq=11681 Ack=417 Win=64240 Len=1460 [TCP segment of a reassembled PDU]"
"54","52146  >  80 [ACK] Seq=417 Ack=13141 Win=64240 Len=0"
"1514","80  >  52145 [ACK] Seq=37386 Ack=430 Win=64240 Len=1460 [TCP segment of a reassembled PDU]"
"1514","80  >  52145 [PSH, ACK] Seq=38846 Ack=430 Win=64240 Len=1460 [TCP segment of a reassembled PDU]"
"54","52145  >  80 [ACK] Seq=430 Ack=40306 Win=64240 Len=0"
"1514","80  >  52145 [PSH, ACK] Seq=40306 Ack=430 Win=64240 Len=1460 [TCP segment of a reassembled PDU]"
"1514","80  >  52145 [PSH, ACK] Seq=41766 Ack=430 Win=64240 Len=1460 [TCP segment of a reassembled PDU]"
"54","52145  >  80 [ACK] Seq=430 Ack=43226 Win=64240 Len=0"
"1514","80  >  52145 [PSH, ACK] Seq=43226 Ack=430 Win=64240 Len=1460 [TCP segment of a reassembled PDU]"
"1514","80  >  52145 [PSH, ACK] Seq=44686 Ack=430 Win=64240 Len=1460 [TCP segment of a reassembled PDU]"
"54","52145  >  80 [ACK] Seq=430 Ack=46146 Win=64240 Len=0"
"1514","80  >  52145 [PSH, ACK] Seq=46146 Ack=430 Win=64240 Len=1460 [TCP segment of a reassembled PDU]"
"1514","80  >  52145 [PSH, ACK] Seq=47606 Ack=430 Win=64240 Len=1460 [TCP segment of a reassembled PDU]"
"54","52145  >  80 [ACK] Seq=430 Ack=49066 Win=61320 Len=0"
"514","GET /fTMgRASiBOAIHNGuCVuGxX8GpnGta4d5DaI6vGgkKPg.jpg HTTP/1.1 "
"60","80  >  52147 [ACK] Seq=10236 Ack=1381 Win=64240 Len=0"
"54","[TCP Window Update] 52145  >  80 [ACK] Seq=430 Ack=49066 Win=64240 Len=0"
"1514","80  >  52146 [ACK] Seq=13141 Ack=417 Win=64240 Len=1460 [TCP segment of a reassembled PDU]"
"1514","80  >  52146 [PSH, ACK] Seq=14601 Ack=417 Win=64240 Len=1460 [TCP segment of a reassembled PDU]"
"54","52146  >  80 [ACK] Seq=417 Ack=16061 Win=64240 Len=0"
"1514","80  >  52146 [ACK] Seq=16061 Ack=417 Win=64240 Len=1460 [TCP segment of a reassembled PDU]"
"1514","80  >  52146 [ACK] Seq=17521 Ack=417 Win=64240 Len=1460 [TCP segment of a reassembled PDU]"
"1514","80  >  52146 [ACK] Seq=18981 Ack=417 Win=64240 Len=1460 [TCP segment of a reassembled PDU]"
"1514","80  >  52146 [PSH, ACK] Seq=20441 Ack=417 Win=64240 Len=1460 [TCP segment of a reassembled PDU]"
"1514","80  >  52146 [PSH, ACK] Seq=21901 Ack=417 Win=64240 Len=1460 [TCP segment of a reassembled PDU]"
"1514","80  >  52146 [PSH, ACK] Seq=23361 Ack=417 Win=64240 Len=1460 [TCP segment of a reassembled PDU]"
"1514","80  >  52146 [PSH, ACK] Seq=24821 Ack=417 Win=64240 Len=1460 [TCP segment of a reassembled PDU]"
"54","52146  >  80 [ACK] Seq=417 Ack=26281 Win=59860 Len=0"
"54","[TCP Window Update] 52146  >  80 [ACK] Seq=417 Ack=26281 Win=64240 Len=0"
"1514","80  >  52146 [ACK] Seq=26281 Ack=417 Win=64240 Len=1460 [TCP segment of a reassembled PDU]"
"1514","80  >  52146 [PSH, ACK] Seq=27741 Ack=417 Win=64240 Len=1460 [TCP segment of a reassembled PDU]"
"1514","80  >  52146 [PSH, ACK] Seq=29201 Ack=417 Win=64240 Len=1460 [TCP segment of a reassembled PDU]"
"54","52146  >  80 [ACK] Seq=417 Ack=30661 Win=64240 Len=0"
"1514","80  >  52145 [ACK] Seq=49066 Ack=430 Win=64240 Len=1460 [TCP segment of a reassembled PDU]"
"1514","80  >  52145 [PSH, ACK] Seq=50526 Ack=430 Win=64240 Len=1460 [TCP segment of a reassembled PDU]"
"54","52145  >  80 [ACK] Seq=430 Ack=51986 Win=64240 Len=0"
"1514","80  >  52145 [PSH, ACK] Seq=51986 Ack=430 Win=64240 Len=1460 [TCP segment of a reassembled PDU]"
